Institution	CatalogNumberPrefix	CatalogNumber	CatalogNumberSuffix	CollectorName	CollectorNumber	Order	Family	Genus.Verb	Species.Verb	Subspecies.Verb	Genus.Clem	Species.Clem	Sex.Verbatim	Sex	Age	Country	ProvinceStateTerritory	PreciseLocation.Verbatim	Locality	Elevation.Verbatim	LatitudeDecimal	LongitudeDecimal	Date.From	Date.To	Date.Verbatim	Year	Month	Day	Date	ExpeditionName	ReproductiveNotes	SoftPartColorNotes	Preparation.Description	Remarks	CollectionName	InventoryStatus	InventoryDateRecorded	DeaccessionDate	DeaccessionMethod	DeaccessionNotes	AccessionNumber
CUMV	NA	8379	NA			NA	Tyrannidae	Zimmerius	nigrocapillus	nigrocapillus	Phyllomyias	nigrocapillus	NA	undetermined		Colombia		Choachi	NA	NA	4.528593	-73.922986	1	1	1860-01-01	1860	1	1	1860.01.01	NA			study skin	Date may be December, 1916.	From the collection of Frank S Wright.	NA	NA	NA	NA	NA	NA
CUMV	NA	5750	NA	Henry K. Coale		NA	Galbulidae	Galbula	ruficauda	ruficauda	Galbula	ruficauda	NA	male		Colombia	Cundinamarca	Fusugasuga	NA	NA	4.34	-74.36	1	1	1860-01-01	1860	1	1	1860.01.01	NA			study skin		From the collection of Frank S Wright.	NA	NA	NA	NA	NA	NA
CUMV	NA	8338	NA		456	NA	Tyrannidae	Lophotriccus	pileatus	squamaecrista	Lophotriccus	pileatus	NA			Colombia	Cundinamarca	Fusugasuga	NA	NA	4.34	-74.36	1	1	1860-01-01	1860	1	1	1860.01.01	NA			study skin		From the collection of Frank S Wright.	NA	NA	NA	NA	NA	NA
CUMV	NA	16974	NA			NA	Parulidae	Basileuterus	coronatus		Myiothlypis	coronata	NA	undetermined		Colombia		Choachi	NA	NA	4.528593	-73.922986	1	1	1860-01-01	1860	1	1	1860.01.01	NA			study skin	Date='11-JAN-1909'	From the collection of Frank S Wright.	NA	NA	NA	NA	NA	NA
CUMV	NA	22837	NA			NA	Thraupidae	Tangara	arthus		Tangara	arthus	NA			Colombia	Cundinamarca	Fusugasuga	NA	NA	4.34	-74.36	1	1	1860-01-01	1860	1	1	1860.01.01	NA			study skin		From the collection of Frank S Wright.	NA	NA	NA	NA	NA	NA
CUMV	NA	4624	NA			NA	Trochilidae	Chrysuronia	oenone	longirostris	Chrysuronia	oenone	NA	female		Colombia	Cundinamarca	Bogota; istrito Capital de	NA	NA	4.609866	-74.08205	1	1	1860-01-01	1860	1	1	1860.01.01	NA			study skin		From the collection of Louis Agassiz Fuertes.  Previously from the collection of H.K. Coale, No. 17077.	NA	NA	NA	NA	NA	NA
CUMV	NA	5032	NA			NA	Trochilidae	Coeligena	coeligena	columbiana	Coeligena	coeligena	NA	male		Colombia	Cundinamarca	Bogota; istrito Capital de	NA	NA	4.609866	-74.08205	1	1	1860-01-01	1860	1	1	1860.01.01	NA			study skin		From the collection of Frank S. Wright.  Number 168 is recorded on the original label.	NA	NA	NA	NA	NA	NA
CUMV	NA	5198	NA			NA	Trochilidae	Metallura	tyrianthina	tyrianthina	Metallura	tyrianthina	NA	female	immature	Colombia	Cundinamarca	Bogota; istrito Capital de	NA	NA	4.609866	-74.08205	1	1	1860-01-01	1860	1	1	1860.01.01	NA			study skin		[In size approaching M.t. quitensis but Chapman says quitensis is restricted to Quito region - GMS.]; From the collection of Frank S. Wright.	NA	NA	NA	NA	NA	NA
CUMV	NA	5209	NA			NA	Trochilidae	Oxypogon	guerinii		Oxypogon	guerinii	NA	male		Colombia	Cundinamarca	Bogota; istrito Capital de	NA	NA	4.609866	-74.08205	1	1	1860-01-01	1860	1	1	1860.01.01	NA			study skin		From the collection of Frank S. Wright.  Previously from the collection of H.K. Coale, No. 27044.	NA	NA	NA	NA	NA	NA
CUMV	NA	5482	NA			NA	Trogonidae	Pharomachrus	auriceps		Pharomachrus	auriceps	NA	male		Colombia	Cundinamarca	Bogota; istrito Capital de	NA	NA	4.609866	-74.08205	1	1	1860-01-01	1860	1	1	1860.01.01	NA			study skin		From the collection of Frank S. Wright.  Numbers 289 and 2887 are recorded on the original label.	NA	NA	NA	NA	NA	NA
CUMV	NA	5925	NA			NA	Ramphastidae	Eubucco	richardsoni	granadensis	Eubucco	richardsoni	NA	female		Colombia	Cundinamarca	Bogota; istrito Capital de	NA	NA	4.609866	-74.08205	1	1	1860-01-01	1860	1	1	1860.01.01	NA			study skin		From the collection of Frank S Wright. Missing one leg.	NA	NA	NA	NA	NA	NA
CUMV	NA	16953	NA			NA	Parulidae	Myioborus	ornatus		Myioborus	ornatus	NA	male		Colombia	Cundinamarca	Bogota; istrito Capital de	NA	NA	4.609866	-74.08205	1	1	1860-01-01	1860	1	1	1860.01.01	NA			study skin		From the collection of Frank S Wright.	NA	NA	NA	NA	NA	NA
CUMV	NA	18611	NA			NA	Emberizidae	Sporophila	intermedia		Sporophila	intermedia	NA	male		Colombia	Cundinamarca	Bogota; istrito Capital de	NA	NA	4.609866	-74.08205	1	1	1860-01-01	1860	1	1	1860.01.01	NA			study skin		From the collection of Frank S Wright.	NA	NA	NA	NA	NA	NA
CUMV	NA	19058	NA			NA	Emberizidae	Atlapetes	schistaceus		Atlapetes	schistaceus	NA			Colombia	Cundinamarca	Bogota; istrito Capital de	NA	NA	4.609866	-74.08205	1	1	1860-01-01	1860	1	1	1860.01.01	NA			study skin		From the collection of Frank S Wright. Possible insect damage noted 14-Apr-2010, tray vacuumed, entire contents of case frozen	NA	NA	NA	NA	NA	NA
CUMV	NA	5082	NA			NA	Trochilidae	Boissonneaua	flavescens		Boissonneaua	flavescens	NA	male		Colombia	Cundinamarca	Bogota; istrito Capital de	NA	NA	4.609866	-74.08205	1	1	1860-01-01	1860	1	1	1860.01.01	NA			study skin		From the collection of Frank S. Wright.  Previously from the collection of H.K. Coale, No. 27641.	NA	NA	NA	NA	NA	NA
CUMV	NA	5160	NA			NA	Trochilidae	Heliangelus	amethysticollis	clarisse	Heliangelus	amethysticollis	NA	male		Colombia	Cundinamarca	Bogota; istrito Capital de	NA	NA	4.609866	-74.08205	1	1	1860-01-01	1860	1	1	1860.01.01	NA			study skin		From the collection of Frank S. Wright.  Previously from the collection of H.K. Coale, No. 25894.  Number 1333 is recorded on the original label.	NA	NA	NA	NA	NA	NA
CUMV	NA	5199	NA			NA	Trochilidae	Metallura	tyrianthina	tyrianthina	Metallura	tyrianthina	NA	male	immature	Colombia	Cundinamarca	Bogota; istrito Capital de	NA	NA	4.609866	-74.08205	1	1	1860-01-01	1860	1	1	1860.01.01	NA			study skin		From the collection of Frank S. Wright.  Number 15/5 is recorded on an earlier label.	NA	NA	NA	NA	NA	NA
CUMV	NA	4419	NA			NA	Trochilidae	Doryfera	johannae		Doryfera	johannae	NA	male		Colombia	Cundinamarca	Bogota; istrito Capital de	NA	NA	4.609866	-74.08205	1	1	1860-01-01	1860	1	1	1860.01.01	NA			study skin		From the collection of Frank S. Wright.	NA	NA	NA	NA	NA	NA
CUMV	NA	6048	NA			NA	Ramphastidae	Andigena	nigrirostris	occidentalis	Andigena	nigrirostris	NA	undetermined		Colombia	Cundinamarca	Bogota; istrito Capital de	NA	NA	4.609866	-74.08205	1	1	1860-01-01	1860	1	1	1860.01.01	NA			study skin		From the collection of Frank S Wright.	NA	NA	NA	NA	NA	NA
CUMV	NA	22861	NA			NA	Thraupidae	Tangara	cyanicollis		Stilpnia	cyanicollis	NA	male		Colombia	Cundinamarca	Bogota; istrito Capital de	NA	NA	4.609866	-74.08205	1	1	1860-01-01	1860	1	1	1860.01.01	NA			study skin		From the collection of Frank S Wright.	NA	NA	NA	NA	NA	NA
CUMV	NA	20897	NA			NA	Thraupidae	Anisognathus	igniventris		Anisognathus	igniventris	NA	male		Colombia	Cundinamarca	Bogota; istrito Capital de	NA	NA	4.609866	-74.08205	1	1	1860-01-01	1860	1	1	1860.01.01	NA			study skin		From the collection of Frank S Wright.	NA	NA	NA	NA	NA	NA
CUMV	NA	5195	NA			NA	Trochilidae	Metallura	tyrianthina	tyrianthina	Metallura	tyrianthina	NA	female		Colombia	Cundinamarca	Bogota; istrito Capital de	NA	NA	4.609866	-74.08205	1	1	1860-01-01	1860	1	1	1860.01.01	NA			study skin		Previously from the collection of H.K. Coale, No. 27046; Brodkorb No. 4091.	NA	NA	NA	NA	NA	NA
CUMV	NA	23042	NA			NA	Thraupidae	Cnemoscopus	rubrirostris		Cnemoscopus	rubrirostris	NA	male		Colombia	Cundinamarca	Bogota; istrito Capital de	NA	NA	4.609866	-74.08205	1	1	1860-01-01	1860	1	1	1860.01.01	NA			study skin		From the collection of Frank S Wright.	NA	NA	NA	NA	NA	NA
CUMV	NA	15852	NA			NA	Thraupidae	Cyanerpes	caeruleus		Cyanerpes	caeruleus	NA	female		Colombia	Cundinamarca	Bogota; istrito Capital de	NA	NA	4.609866	-74.08205	1	1	1860-01-01	1860	1	1	1860.01.01	NA			study skin		From the collection of Frank S Wright.	NA	NA	NA	NA	NA	NA
CUMV	NA	18121	NA			NA	Cardinalidae	Saltator	maximus		Saltator	maximus	NA	male		Colombia	Cundinamarca	Bogota; istrito Capital de	NA	NA	4.609866	-74.08205	1	1	1860-01-01	1860	1	1	1860.01.01	NA			study skin		From the collection of Frank S Wright.	NA	NA	NA	NA	NA	NA
CUMV	NA	7179	NA			NA	Thamnophilidae	Pithys	albifrons	peruviana	Pithys	albifrons	NA	male		Colombia	Cundinamarca	Bogota; istrito Capital de	NA	NA	4.609866	-74.08205	1	1	1860-01-01	1860	1	1	1860.01.01	NA			study skin		From the collection of Frank S Wright. From the collection of Henry K Coale #15910 and Pierce Brodkorb #3659	NA	NA	NA	NA	NA	NA
CUMV	NA	13658	NA			NA	Thraupidae	Rhodinocichla	rosea		Rhodinocichla	rosea	NA	female		Colombia	Cundinamarca	Bogota; istrito Capital de	NA	NA	4.609866	-74.08205	1	1	1860-01-01	1860	1	1	1860.01.01	NA			study skin		From the collection of Frank S Wright.	NA	NA	NA	NA	NA	NA
CUMV	NA	5162	NA	H. Whitely		NA	Trochilidae	Heliangelus	amethysticollis	clarisse	Heliangelus	amethysticollis	NA	male		Colombia	Cundinamarca	Bogota; istrito Capital de	NA	NA	4.609866	-74.08205	1	1	1860-01-01	1860	1	1	1860.01.01	NA			study skin		From the collection of Frank S. Wright.  Number 2546 is recorded on the original label.	NA	NA	NA	NA	NA	NA
CUMV	NA	4732	NA			NA	Trochilidae	Chalybura	buffonii		Chalybura	buffonii	NA	female		Colombia	Cundinamarca	Bogota; istrito Capital de	NA	NA	4.609866	-74.08205	1	1	1860-01-01	1860	1	1	1860.01.01	NA			study skin		From the collection of Frank S. Wright.	NA	NA	NA	NA	NA	NA
CUMV	NA	5254	NA			NA	Trochilidae	Lesbia	victoriae	victoriae	Lesbia	victoriae	NA	male		Colombia	Cundinamarca	Bogota; istrito Capital de	NA	NA	4.609866	-74.08205	1	1	1860-01-01	1860	1	1	1860.01.01	NA			study skin		From the collection of Frank S. Wright.	NA	NA	NA	NA	NA	NA
CUMV	NA	7290	NA			NA	Cotingidae	Pachyramphus	versicolor	versicolor	Pachyramphus	versicolor	NA	male		Colombia	Cundinamarca	Bogota; istrito Capital de	NA	NA	4.609866	-74.08205	1	1	1860-01-01	1860	1	1	1860.01.01	NA			study skin		From the collection of Frank S Wright.	NA	NA	NA	NA	NA	NA
CUMV	NA	7383	NA			NA	Pipridae	Pipra	isidorei	isidorei	Lepidothrix	isidorei	NA	male		Colombia	Cundinamarca	Bogota; istrito Capital de	NA	NA	4.609866	-74.08205	1	1	1860-01-01	1860	1	1	1860.01.01	NA			study skin		From the collection of Frank S Wright.	NA	NA	NA	NA	NA	NA
CUMV	NA	13984	NA			NA	Polioptilidae	Polioptila	plumbea	anteocularis	Polioptila	plumbea	NA	male		Colombia	Cundinamarca	Bogota; istrito Capital de	NA	NA	4.609866	-74.08205	1	1	1860-01-01	1860	1	1	1860.01.01	NA			study skin			NA	NA	NA	NA	NA	NA
CUMV	NA	15782	NA			NA	Vireonidae	Vireo	gilvus		Vireo	gilvus	NA	male		Colombia	Cundinamarca	Bogota; istrito Capital de	NA	NA	4.609866	-74.08205	1	1	1860-01-01	1860	1	1	1860.01.01	NA			study skin		From the collection of Frank S Wright.	NA	NA	NA	NA	NA	NA
CUMV	NA	18060	NA			NA	Icteridae	Cacicus	leucoramphus		Cacicus	chrysonotus	NA	male		Colombia	Cundinamarca	Bogota; istrito Capital de	NA	NA	4.609866	-74.08205	1	1	1860-01-01	1860	1	1	1860.01.01	NA			study skin		From the collection of Frank S Wright.	NA	NA	NA	NA	NA	NA
CUMV	NA	19063	NA			NA	Emberizidae	Atlapetes	semirufus		Atlapetes	semirufus	NA	male		Colombia	Cundinamarca	Bogota; istrito Capital de	NA	NA	4.609866	-74.08205	1	1	1860-01-01	1860	1	1	1860.01.01	NA			study skin		From the collection of Frank S Wright.	NA	NA	NA	NA	NA	NA
CUMV	NA	4455	NA			NA	Trochilidae	Eutoxeres	aquila		Eutoxeres	aquila	NA	male		Colombia	Cundinamarca	Bogota; istrito Capital de	NA	NA	4.609866	-74.08205	1	1	1860-01-01	1860	1	1	1860.01.01	NA			study skin		From the collection of Frank S. Wright.	NA	NA	NA	NA	NA	NA
CUMV	NA	4525	NA			NA	Trochilidae	Lepidopyga	goudoti		Lepidopyga	goudoti	NA	male	immature	Colombia	Cundinamarca	Bogota; istrito Capital de	NA	NA	4.609866	-74.08205	1	1	1860-01-01	1860	1	1	1860.01.01	NA			study skin		From the collection of Frank S. Wright.	NA	NA	NA	NA	NA	NA
CUMV	NA	19059	NA			NA	Emberizidae	Atlapetes	schistaceus		Atlapetes	schistaceus	NA			Colombia	Cundinamarca	Bogota; istrito Capital de	NA	NA	4.609866	-74.08205	1	1	1860-01-01	1860	1	1	1860.01.01	NA			study skin		From the collection of Frank S Wright.	NA	NA	NA	NA	NA	NA
CUMV	NA	5283	NA			NA	Trochilidae	Heliomaster	longirostris	longirostris	Heliomaster	longirostris	NA	male		Colombia	Cundinamarca	Bogota; istrito Capital de	NA	NA	4.609866	-74.08205	1	1	1860-01-01	1860	1	1	1860.01.01	NA			study skin		From the collection of Frank S. Wright.  Numbers 15/14 and 1811 are recorded on the original label.	NA	NA	NA	NA	NA	NA
CUMV	NA	15851	NA			NA	Thraupidae	Cyanerpes	caeruleus		Cyanerpes	caeruleus	NA	in question		Colombia	Cundinamarca	Bogota; istrito Capital de	NA	NA	4.609866	-74.08205	1	1	1860-01-01	1860	1	1	1860.01.01	NA			study skin		From the collection of Frank S Wright.	NA	NA	NA	NA	NA	NA
CUMV	NA	22874	NA			NA	Thraupidae	Tangara	ruficervix		Chalcothraupis	ruficervix	NA	male		Colombia	Cundinamarca	Bogota; istrito Capital de	NA	NA	4.609866	-74.08205	1	1	1860-01-01	1860	1	1	1860.01.01	NA			study skin		From the collection of Frank S Wright.	NA	NA	NA	NA	NA	NA
CUMV	NA	20717	NA			NA	Cardinalidae	Piranga	rubiceps		Piranga	rubriceps	NA	male		Colombia	Cundinamarca	Bogota; istrito Capital de	NA	NA	4.609866	-74.08205	1	1	1860-01-01	1860	1	1	1860.01.01	NA			study skin			NA	NA	NA	NA	NA	NA
CUMV	NA	4552	NA			NA	Trochilidae	Amazilia	viridigaster		Amazilia	viridigaster	NA	male		Colombia	Cundinamarca	Bogota; istrito Capital de	NA	NA	4.609866	-74.08205	1	1	1860-01-01	1860	1	1	1860.01.01	NA			study skin		From the collection of Frank S. Wright.  No. 184 is recorded on the original label.	NA	NA	NA	NA	NA	NA
CUMV	NA	5084	NA			NA	Trochilidae	Boissonneaua	flavescens		Boissonneaua	flavescens	NA	female		Colombia	Cundinamarca	Bogota; istrito Capital de	NA	NA	4.609866	-74.08205	1	1	1860-01-01	1860	1	1	1860.01.01	NA			study skin		From the collection of H.K. Coale, No. 27039.	NA	NA	NA	NA	NA	NA
CUMV	NA	22849	NA			NA	Thraupidae	Tangara	labradorides		Tangara	labradorides	NA	male		Colombia	Cundinamarca	Bogota; istrito Capital de	NA	NA	4.609866	-74.08205	1	1	1860-01-01	1860	1	1	1860.01.01	NA			study skin		From the collection of Frank S Wright.	NA	NA	NA	NA	NA	NA
CUMV	NA	18220	NA			NA	Thraupidae	Catamblyrhynchus	diadema		Catamblyrhynchus	diadema	NA	undetermined		Colombia	Cundinamarca	Bogota; istrito Capital de	NA	NA	4.609866	-74.08205	1	1	1860-01-01	1860	1	1	1860.01.01	NA			study skin		From the collection of Frank S Wright.	NA	NA	NA	NA	NA	NA
CUMV	NA	5120	NA			NA	Trochilidae	Haplophaedia	aureliae	aureliae	Haplophaedia	aureliae	NA	female		Colombia	Cundinamarca	Bogota; istrito Capital de	NA	NA	4.609866	-74.08205	1	1	1860-01-01	1860	1	1	1860.01.01	NA			study skin		From the collection of Frank S. Wright.  Previously from the collection of H.K. Coale, 27053.	NA	NA	NA	NA	NA	NA
CUMV	NA	5192	NA			NA	Trochilidae	Metallura	tyrianthina	tyrianthina	Metallura	tyrianthina	NA	male		Colombia	Cundinamarca	Bogota; istrito Capital de	NA	NA	4.609866	-74.08205	1	1	1860-01-01	1860	1	1	1860.01.01	NA			study skin		From the collection of H.K. Coale, No. 16425; Brodkorb No. 3875.	NA	NA	NA	NA	NA	NA
CUMV	NA	18161	NA			NA	Thraupidae	Chlorophonia	pyrrhophrys		Chlorophonia	pyrrhophrys	NA	male		Colombia	Cundinamarca	Bogota; istrito Capital de	NA	NA	4.609866	-74.08205	1	1	1860-01-01	1860	1	1	1860.01.01	NA			study skin		From the collection of Frank S Wright.	NA	NA	NA	NA	NA	NA
CUMV	NA	16976	NA			NA	Parulidae	Basileuterus	luteoviridis		Myiothlypis	luteoviridis	NA			Colombia	Cundinamarca	Bogota; istrito Capital de	NA	NA	4.609866	-74.08205	1	1	1860-01-01	1860	1	1	1860.01.01	NA			study skin		From the collection of Frank S Wright.	NA	NA	NA	NA	NA	NA
CUMV	NA	5083	NA			NA	Trochilidae	Boissonneaua	flavescens		Boissonneaua	flavescens	NA	male		Colombia	Cundinamarca	Bogota; istrito Capital de	NA	NA	4.609866	-74.08205	1	1	1860-01-01	1860	1	1	1860.01.01	NA			study skin		From the collection of H.K. Coale, No. 23941.	NA	NA	NA	NA	NA	NA
CUMV	NA	20850	NA			NA	Fringillidae	Euphonia	concinna		Euphonia	concinna	NA	male		Colombia	Cundinamarca	Bogota; istrito Capital de	NA	NA	4.609866	-74.08205	1	1	1860-01-01	1860	1	1	1860.01.01	NA			study skin		From the collection of Frank S Wright.	NA	NA	NA	NA	NA	NA
CUMV	NA	34203	NA			NA	Thraupidae	Catamblyrhynchus	diadema		Catamblyrhynchus	diadema	NA	male		Colombia	Cundinamarca	Bogota; istrito Capital de	NA	NA	4.609866	-74.08205	1	1	1860-01-01	1860	1	1	1860.01.01	NA			study skin		From the Rivola collection.	NA	NA	NA	NA	NA	NA
CUMV	NA	4656	NA			NA	Trochilidae	Chlorostilbon	gibsoni		Chlorostilbon	gibsoni	NA	male		Colombia	Cundinamarca	Bogota; istrito Capital de	NA	NA	4.609866	-74.08205	1	1	1860-01-01	1860	1	1	1860.01.01	NA			study skin		From the collection of Louis Agassiz Fuertes.	NA	NA	NA	NA	NA	NA
CUMV	NA	5455	NA	H. Whitely		NA	Trochilidae	Lophornis	delattrei		Lophornis	delattrei	NA	male		Colombia			NA	NA	NA	NA	1	1	1860-01-01	1860	1	1	1860.01.01	NA			study skin		From the collection of Frank S. Wright.  The number 139/1 is recorded on the original label.	NA	NA	NA	NA	NA	NA
CUMV	NA	4489	NA			NA	Trochilidae	Florisuga	mellivora		Florisuga	mellivora	NA	male	immature	Colombia			NA	NA	NA	NA	1	1	1860-01-01	1860	1	1	1860.01.01	NA			study skin		From the collection of Frank S. Wright.  Previously from the collection of H.K. Coale, No. 16987.	NA	NA	NA	NA	NA	NA
CUMV	NA	4527	NA			NA	Trochilidae	Amazilia	cyanifrons		Amazilia	cyanifrons	NA	male		Colombia			NA	NA	NA	NA	1	1	1860-01-01	1860	1	1	1860.01.01	NA			study skin		From the collection of Louis Agassiz Fuertes.  Previously from the colleciton of H.K. Coale, No. 16421.	NA	NA	NA	NA	NA	NA
CUMV	NA	4638	NA			NA	Trochilidae	Damophila	julie	julie	Juliamyia	julie	NA	male		Colombia			NA	NA	NA	NA	1	1	1860-01-01	1860	1	1	1860.01.01	NA			study skin		From the collection of Frank S. Wright.	NA	NA	NA	NA	NA	NA
CUMV	NA	4676	NA			NA	Trochilidae	Chlorostilbon	poortmani		Chlorostilbon	poortmani	NA	male	immature	Colombia			NA	NA	NA	NA	1	1	1860-01-01	1860	1	1	1860.01.01	NA			study skin		From the collection of Frank S. Wright.  Previously from the collection of H.K. Coale, No. 19704.	NA	NA	NA	NA	NA	NA
CUMV	NA	4970	NA			NA	Trochilidae	Heliodoxa	rubinoides		Heliodoxa	rubinoides	NA	male	immature	Colombia			NA	NA	NA	NA	1	1	1860-01-01	1860	1	1	1860.01.01	NA			study skin		From the collection of Frank S. Wright.  Previously from the collection of H.K. Coale, No. 28932.  The number 470 is recorded on the original label from the Museum Boucard.	NA	NA	NA	NA	NA	NA
CUMV	NA	4992	NA			NA	Trochilidae	Coeligena	bonapartei		Coeligena	bonapartei	NA	female		Colombia			NA	NA	NA	NA	1	1	1860-01-01	1860	1	1	1860.01.01	NA			study skin		From the collection of Frank S. Wright. Previously from the collection of H.K. Coale, No. 28927.	NA	NA	NA	NA	NA	NA
CUMV	NA	5040	NA			NA	Trochilidae	Lafresnaya	lafresnayi		Lafresnaya	lafresnayi	NA	female		Colombia			NA	NA	NA	NA	1	1	1860-01-01	1860	1	1	1860.01.01	NA			study skin		From the collection of Louis Agassiz Fuertes.  Previously from the Carpenter Collection.	NA	NA	NA	NA	NA	NA
CUMV	NA	5042	NA			NA	Trochilidae	Lafresnaya	lafresnayi		Lafresnaya	lafresnayi	NA	female		Colombia			NA	NA	NA	NA	1	1	1860-01-01	1860	1	1	1860.01.01	NA			study skin		From the collection of Frank S. Wright.  Previously from the collection of H.K. Coale.	NA	NA	NA	NA	NA	NA
CUMV	NA	5067	NA			NA	Trochilidae	Aglaeactis	cupripennis		Aglaeactis	cupripennis	NA	female		Colombia			NA	NA	NA	NA	1	1	1860-01-01	1860	1	1	1860.01.01	NA			study skin		From the collection of Frank S. Wright.  The number 2799 is recorded on the original label.	NA	NA	NA	NA	NA	NA
CUMV	NA	5076	NA			NA	Trochilidae	Boissonneaua	flavescens		Boissonneaua	flavescens	NA	in question		Colombia			NA	NA	NA	NA	1	1	1860-01-01	1860	1	1	1860.01.01	NA			study skin		From the collection of Louis Agassiz Fuertes.  Previously from the Carpenter Collection.	NA	NA	NA	NA	NA	NA
CUMV	NA	5119	NA			NA	Trochilidae	Haplophaedia	aureliae	aureliae	Haplophaedia	aureliae	NA	male	immature	Colombia			NA	NA	NA	NA	1	1	1860-01-01	1860	1	1	1860.01.01	NA			study skin		From the collection of Louis Agassiz Fuertes.  Previously from the collection of H.K Coale, No. 19070.	NA	NA	NA	NA	NA	NA
CUMV	NA	5125	NA			NA	Trochilidae	Eriocnemis	alinae		Eriocnemis	aline	NA	male		Colombia			NA	NA	NA	NA	1	1	1860-01-01	1860	1	1	1860.01.01	NA			study skin		From the collection of Frank S. Wright.  Number 470 is recorded on the original label from the Museum Boucard.	NA	NA	NA	NA	NA	NA
CUMV	NA	5161	NA			NA	Trochilidae	Heliangelus	amethysticollis	clarisse	Heliangelus	amethysticollis	NA	male	immature	Colombia			NA	NA	NA	NA	1	1	1860-01-01	1860	1	1	1860.01.01	NA			study skin		From the collection of Frank S. Wright.  Previously from the collection of H.K. Coale, No. 19653; Brodkorb No. 4097.	NA	NA	NA	NA	NA	NA
CUMV	NA	5239	NA			NA	Trochilidae	Aglaiocercus	kingi		Aglaiocercus	kingii	NA	male		Colombia			NA	NA	NA	NA	1	1	1860-01-01	1860	1	1	1860.01.01	NA			study skin		From the collection of Frank S. Wright.  Exchanged to Carleton College, 1942.	NA	NA	NA	NA	NA	NA
CUMV	NA	5433	NA			NA	Trochilidae	Chaetocercus	mulsant		Chaetocercus	mulsant	NA	male		Colombia			NA	NA	NA	NA	1	1	1860-01-01	1860	1	1	1860.01.01	NA			study skin		From the collection of Frank S. Wright.	NA	NA	NA	NA	NA	NA
CUMV	NA	6235	NA			NA	Picidae	Melanerpes	subelegans		Melanerpes	rubricapillus	NA	in question		Colombia			NA	NA	NA	NA	1	1	1860-01-01	1860	1	1	1860.01.01	NA			study skin		From the collection of Frank S Wright.	NA	NA	NA	NA	NA	NA
CUMV	NA	6955	NA			NA	Furnariidae	Pseudocolaptes	boissonneautii	boissonneautii	Pseudocolaptes	boissonneautii	NA	male		Colombia		Santa Elena	NA	NA	NA	NA	1	1	1860-01-01	1860	1	1	1860.01.01	NA		{colors:Leg color: salmon }	study skin		From the collection of Frank S Wright.	NA	NA	NA	NA	NA	NA
CUMV	NA	7198	NA			NA	Formicariidae	Grallaria	squamigera	squamigera	Grallaria	squamigera	NA	undetermined		Colombia			NA	NA	NA	NA	1	1	1860-01-01	1860	1	1	1860.01.01	NA			study skin		From the collection of Frank S Wright.	NA	NA	NA	NA	NA	NA
CUMV	NA	13293	NA		FSW 15105	NA	Troglodytidae	Cinnycerthia	unirufa	unirufa	Cinnycerthia	unirufa	NA			Colombia			NA	NA	NA	NA	1	1	1860-01-01	1860	1	1	1860.01.01	NA			study skin		From the collection of Frank S Wright.	NA	NA	NA	NA	NA	NA
CUMV	NA	15844	NA			NA	Thraupidae	Diglossa	caerulescens		Diglossa	caerulescens	NA			Colombia			NA	NA	NA	NA	1	1	1860-01-01	1860	1	1	1860.01.01	NA			study skin			NA	NA	NA	NA	NA	NA
CUMV	NA	15872	NA			NA	Thraupidae	Cyanerpes	cyaneus		Cyanerpes	cyaneus	NA	male		Colombia			NA	NA	NA	NA	1	1	1860-01-01	1860	1	1	1860.01.01	NA			study skin		From the collection of Frank S Wright.	NA	NA	NA	NA	NA	NA
CUMV	NA	15931	NA			NA	Thraupidae	Conirostrum	sitticolor		Conirostrum	sitticolor	NA	male		Colombia			NA	NA	NA	NA	1	1	1860-01-01	1860	1	1	1860.01.01	NA			study skin		From the collection of Frank S Wright.	NA	NA	NA	NA	NA	NA
CUMV	NA	15917	NA			NA	Thraupidae	Chlorophanes	spiza		Chlorophanes	spiza	NA	male		Colombia			NA	NA	NA	NA	1	1	1860-01-01	1860	1	1	1860.01.01	NA			study skin		From the collection of Frank S Wright.	NA	NA	NA	NA	NA	NA
CUMV	NA	18141	NA			NA	Cardinalidae	Saltator	albicollis		Saltator	albicollis	NA	undetermined		Colombia			NA	NA	NA	NA	1	1	1860-01-01	1860	1	1	1860.01.01	NA			study skin		From the collection of Frank S Wright.	NA	NA	NA	NA	NA	NA
CUMV	NA	22815	NA			NA	Thraupidae	Tangara	chilensis		Tangara	chilensis	NA	male		Colombia			NA	NA	NA	NA	1	1	1860-01-01	1860	1	1	1860.01.01	NA			study skin			NA	NA	NA	NA	NA	NA
CUMV	NA	6055	NA			NA	Ramphastidae	Aulacorhynchus	albivitta	albivitta	Aulacorhynchus	albivitta	NA	male		Colombia			NA	NA	NA	NA	1	1	1860-01-01	1860	1	1	1860.01.01	NA			study skin	'Imported by WFH Rosenberg'	From the collection of Frank S Wright.	NA	NA	NA	NA	NA	NA
CUMV	NA	4639	NA			NA	Trochilidae	Damophila	julie	julie	Juliamyia	julie	NA	female		Colombia			NA	NA	NA	NA	1	1	1860-01-01	1860	1	1	1860.01.01	NA			study skin		From the collection of Frank S. Wright.	NA	NA	NA	NA	NA	NA
CUMV	NA	4675	NA			NA	Trochilidae	Chlorostilbon	poortmani		Chlorostilbon	poortmani	NA	male		Colombia			NA	NA	NA	NA	1	1	1860-01-01	1860	1	1	1860.01.01	NA			study skin		From the collection of Louis Agassiz Fuertes.  Previously from the Carpenter Collection.	NA	NA	NA	NA	NA	NA
CUMV	NA	5207	NA			NA	Trochilidae	Oxypogon	guerinii		Oxypogon	guerinii	NA	undetermined		Colombia			NA	NA	NA	NA	1	1	1860-01-01	1860	1	1	1860.01.01	NA			study skin		From the collection of Louis Agassiz Fuertes.  Previously from the Carpenter Collection.	NA	NA	NA	NA	NA	NA
CUMV	NA	7421	NA			NA	Pipridae	Pipra	filicauda		Pipra	filicauda	NA	male		Colombia			NA	NA	NA	NA	1	1	1860-01-01	1860	1	1	1860.01.01	NA			study skin		From the collection of Henry K Coale. From the collection of Frank S Wright.	NA	NA	NA	NA	NA	NA
CUMV	NA	10545	NA			NA	Corvidae	Cyanolyca	armillata		Cyanolyca	armillata	NA	male		Colombia			NA	NA	NA	NA	1	1	1860-01-01	1860	1	1	1860.01.01	NA			study skin		From the collection of Frank S Wright.	NA	NA	NA	NA	NA	NA
CUMV	NA	4528	NA			NA	Trochilidae	Amazilia	cyanifrons		Amazilia	cyanifrons	NA	female		Colombia			NA	NA	NA	NA	1	1	1860-01-01	1860	1	1	1860.01.01	NA			study skin		From the collection of Frank S. Wright.  Previously from the collection of H.K. Coale, No. 28964.   The number 470 is recorded on the original label from the Museum Boucard.	NA	NA	NA	NA	NA	NA
CUMV	NA	4734	NA	H. Whitely		NA	Trochilidae	Chalybura	buffonii	caeruleogaster	Chalybura	buffonii	NA	male		Colombia			NA	NA	NA	NA	1	1	1860-01-01	1860	1	1	1860.01.01	NA			study skin		From the collection of Frank S. Wright.	NA	NA	NA	NA	NA	NA
CUMV	NA	5181	NA			NA	Trochilidae	Heliangelus	exortis		Heliangelus	exortis	NA	male		Colombia			NA	NA	NA	NA	1	1	1860-01-01	1860	1	1	1860.01.01	NA			study skin		From the collection of Frank S. Wright.  Numbers 15/16 and 470 are recorded on the original label from the Museum Boucard.	NA	NA	NA	NA	NA	NA
CUMV	NA	5210	NA			NA	Trochilidae	Oxypogon	guerinii		Oxypogon	guerinii	NA	female		Colombia			NA	NA	NA	NA	1	1	1860-01-01	1860	1	1	1860.01.01	NA			study skin		From the collection of Frank S. Wright.  Previously from the collection of H.K. Coale, No. 27502.	NA	NA	NA	NA	NA	NA
CUMV	NA	5015	NA			NA	Trochilidae	Coeligena	helianthea		Coeligena	helianthea	NA	male		Colombia			NA	NA	NA	NA	1	1	1860-01-01	1860	1	1	1860.01.01	NA			study skin		From the collection of Frank S. Wright.	NA	NA	NA	NA	NA	NA
CUMV	NA	5035	NA			NA	Trochilidae	Coeligena	prunellei		Coeligena	prunellei	NA	male		Colombia			NA	NA	NA	NA	1	1	1860-01-01	1860	1	1	1860.01.01	NA			study skin		From the collection of Frank S. Wright.  Numbers 169 and 470 are recorded on the original label from the Museum Boucard.	NA	NA	NA	NA	NA	NA
CUMV	NA	7422	NA			NA	Pipridae	Pipra	filicauda		Pipra	filicauda	NA	male		Colombia			NA	NA	NA	NA	1	1	1860-01-01	1860	1	1	1860.01.01	NA			study skin		From the collection of Frank S Wright. Originally sexed as female.	NA	NA	NA	NA	NA	NA
CUMV	NA	7403	NA			NA	Pipridae	Pipra	erythrocephala	erythrocephala	Ceratopipra	erythrocephala	NA	male		Colombia			NA	NA	NA	NA	1	1	1860-01-01	1860	1	1	1860.01.01	NA			study skin		From the collection of Frank S Wright.  Exchanged to Carleton College.	NA	NA	NA	NA	NA	NA
CUMV	NA	4621	NA			NA	Trochilidae	Chrysuronia	oenone	oenone	Chrysuronia	oenone	NA	male		Colombia			NA	NA	NA	NA	1	1	1860-01-01	1860	1	1	1860.01.01	NA			study skin		From the collection of Frank S. Wright.  The following is recorded on Cornell's specimen label:  'If this bird actually is from Colombia it ought to be longirostris - GMS'.	NA	NA	NA	NA	NA	NA
CUMV	NA	5117	NA			NA	Trochilidae	Haplophaedia	aureliae	aureliae	Haplophaedia	aureliae	NA	female		Colombia			NA	NA	NA	NA	1	1	1860-01-01	1860	1	1	1860.01.01	NA			study skin		From the collection of Louis Agassiz Fuertes.  Previously from the collection of H.K. Coale, No. 16899.	NA	NA	NA	NA	NA	NA
CUMV	NA	7232	NA			NA	Cotingidae	Rupicola	peruviana		Rupicola	peruvianus	NA	male		Colombia			NA	NA	NA	NA	1	1	1860-01-01	1860	1	1	1860.01.01	NA			study skin		From the collection of Frank S Wright.	NA	NA	NA	NA	NA	NA
CUMV	NA	20922	NA			NA	Thraupidae	Chlorornis	riefferii		Chlorornis	riefferii	NA	male		Colombia	Antioquia	Antioquia	NA	NA	NA	NA	1	1	1860-01-01	1860	1	1	1860.01.01	NA			study skin		From the collection of Frank S Wright.	NA	NA	NA	NA	NA	NA
CUMV	NA	7093	NA	Rosenberg		NA	Thamnophilidae	Myrmotherula	surinamensis	pacifica	Myrmotherula	surinamensis	NA	male		Colombia	Valle del Cauca	Rio Dagua; Valle	NA	NA	NA	NA	1	1	1860-01-01	1860	1	1	1860.01.01	NA			study skin		From the collection of Frank S Wright.	NA	NA	NA	NA	NA	NA
CUMV	NA	4444	NA			NA	Trochilidae	Phaethornis	anthophilus		Phaethornis	anthophilus	NA	male		Colombia			NA	NA	NA	NA	1	1	1860-01-01	1860	1	1	1860.01.01	NA			study skin		From the collection of Frank S. Wright.  Imported by W.F.H. Rosenberg, 57, Haverstock Hill, London.	NA	NA	NA	NA	NA	NA
CUMV	NA	5057	NA			NA	Trochilidae	Pterophanes	cyanopterus	temmincki	Pterophanes	cyanopterus	NA	male		Colombia			NA	NA	NA	NA	1	1	1860-01-01	1860	1	1	1860.01.01	NA			study skin		From the collection of Frank S. Wright.  Number 470 is recorded on the original label from the Museum Boucard.	NA	NA	NA	NA	NA	NA
CUMV	NA	7102	NA			NA	Thamnophilidae	Formicivora	grisea	intermedia	Formicivora	grisea	NA	male		Colombia			NA	NA	NA	NA	1	1	1860-01-01	1860	1	1	1860.01.01	NA			study skin		From the collection of Frank S Wright.	NA	NA	NA	NA	NA	NA
CUMV	NA	5014	NA			NA	Trochilidae	Coeligena	helianthea		Coeligena	helianthea	NA	female		Colombia			NA	NA	NA	NA	1	1	1860-01-01	1860	1	1	1860.01.01	NA			study skin		From the collection of Frank S. Wright.  Previously from the collection of H.K. Coale, No. 16869.	NA	NA	NA	NA	NA	NA
CUMV	NA	5115	NA			NA	Trochilidae	Eriocnemis	cupreoventris		Eriocnemis	cupreoventris	NA	male		Colombia			NA	NA	NA	NA	1	1	1860-01-01	1860	1	1	1860.01.01	NA			study skin		Eyelashes black.; From the collection of Frank S. Wright.  Previously from the collection of H.K. Coale, 16450.	NA	NA	NA	NA	NA	NA
CUMV	NA	19101	NA			NA	Emberizidae	Arremon	aurantiirostris		Arremon	aurantiirostris	NA	male		Colombia	Antioquia	Antioquia	NA	NA	NA	NA	1	1	1860-01-01	1860	1	1	1860.01.01	NA			study skin		From the collection of Frank S Wright. Specimen in same tray as insect damaged specimens, March 2010	NA	NA	NA	NA	NA	NA
CUMV	NA	9104	NA			NA	Hirundinidae	Tachycineta	albiventer		Tachycineta	albiventer	NA	male		Colombia			NA	NA	NA	NA	1	1	1860-01-01	1860	1	1	1860.01.01	NA			study skin		From the collection of Frank S Wright.	NA	NA	NA	NA	NA	NA
CUMV	NA	4990	NA			NA	Trochilidae	Coeligena	bonapartei		Coeligena	bonapartei	NA	female		Colombia			NA	NA	NA	NA	1	1	1860-01-01	1860	1	1	1860.01.01	NA			study skin		From the collection of Frank S. Wright.  Number 470 and 'Ven. 17/40, col. 15/19' are recorded on the original label from the Museum Boucard.	NA	NA	NA	NA	NA	NA
CUMV	NA	5255	NA			NA	Trochilidae	Lesbia	victoriae	victoriae	Lesbia	victoriae	NA	female		Colombia			NA	NA	NA	NA	1	1	1860-01-01	1860	1	1	1860.01.01	NA			study skin		From the collection of Frank S. Wright.	NA	NA	NA	NA	NA	NA
CUMV	NA	5464	NA			NA	Trochilidae	Discosura	conversii	conversii	Discosura	conversii	NA	male		Colombia			NA	NA	NA	NA	1	1	1860-01-01	1860	1	1	1860.01.01	NA			study skin		From the collection of Frank S. Wright.  The number 470 is recorded on the original label which is from the Museum Boucard.	NA	NA	NA	NA	NA	NA
CUMV	NA	5180	NA			NA	Trochilidae	Heliangelus	exortis		Heliangelus	exortis	NA	female	immature	Colombia			NA	NA	NA	NA	1	1	1860-01-01	1860	1	1	1860.01.01	NA			study skin		From the collection of H.K. Coale, No. 25867; Brodkorb No. 4096.  Imported by W.F.H. Rosenberg, London.	NA	NA	NA	NA	NA	NA
CUMV	NA	5039	NA			NA	Trochilidae	Lafresnaya	lafresnayi		Lafresnaya	lafresnayi	NA	male		Colombia			NA	NA	NA	NA	1	1	1860-01-01	1860	1	1	1860.01.01	NA			study skin		From the collection of Louis Agassiz Fuertes.  Previously from the Carpenter Collection.	NA	NA	NA	NA	NA	NA
CUMV	NA	22890	NA			NA	Thraupidae	Tangara	gyrola		Tangara	gyrola	NA			Colombia			NA	NA	NA	NA	1	1	1860-01-01	1860	1	1	1860.01.01	NA			study skin			NA	NA	NA	NA	NA	NA
CUMV	NA	15814	NA			NA	Thraupidae	Diglossa	lafresnayii		Diglossa	lafresnayii	NA	male		Colombia			NA	NA	NA	NA	1	1	1860-01-01	1860	1	1	1860.01.01	NA			study skin		From the collection of Frank S Wright.	NA	NA	NA	NA	NA	NA
CUMV	NA	6058	NA			NA	Ramphastidae	Aulacorhynchus	albivitta	phaeolaemus	Aulacorhynchus	albivitta	NA	male		Colombia			NA	NA	NA	NA	1	1	1860-01-01	1860	1	1	1860.01.01	NA			study skin		From the collection of Frank S Wright.	NA	NA	NA	NA	NA	NA
CUMV	NA	4629	NA			NA	Trochilidae	Chlorestes	notatus		Chlorestes	notata	NA	male		Colombia			NA	NA	NA	NA	1	1	1860-01-01	1860	1	1	1860.01.01	NA			study skin		Eyelashes black.; From the collection of Louis Agassiz Fuertes.  Previously from the collection of H.K. Coale, No. 9734A.	NA	NA	NA	NA	NA	NA
CUMV	NA	17969	NA			NA	Icteridae	Molothrus	bonariensis	cabanisii	Molothrus	bonariensis	NA	male		Colombia			NA	NA	NA	NA	1	1	1860-01-01	1860	1	1	1860.01.01	NA			study skin		From the collection of Frank S Wright.	NA	NA	NA	NA	NA	NA
CUMV	NA	5056	NA			NA	Trochilidae	Pterophanes	cyanopterus	temmincki	Pterophanes	cyanopterus	NA	female	immature	Colombia			NA	NA	NA	NA	1	1	1860-01-01	1860	1	1	1860.01.01	NA			study skin		From the collection of Louis Agassiz Fuertes.  Previously from the Carpenter Collection.	NA	NA	NA	NA	NA	NA
CUMV	NA	5066	NA			NA	Trochilidae	Aglaeactis	cupripennis		Aglaeactis	cupripennis	NA	male		Colombia			NA	NA	NA	NA	1	1	1860-01-01	1860	1	1	1860.01.01	NA			study skin		From the collection of Frank S. Wright.  The numbers 3065 and 15/128 are recorded on the original label from W.F.H. Rosenberg, London.	NA	NA	NA	NA	NA	NA
CUMV	NA	4658	NA			NA	Trochilidae	Chlorostilbon	gibsoni		Chlorostilbon	gibsoni	NA	male		Colombia			NA	NA	NA	NA	1	1	1860-01-01	1860	1	1	1860.01.01	NA			study skin		From the collection of Frank S. Wright.  Imported by W.F.H. Rosenberg, 57, Haverstock Hill, London.	NA	NA	NA	NA	NA	NA
CUMV	NA	5022	NA	H. Whitely		NA	Trochilidae	Coeligena	torquata		Coeligena	torquata	NA	male		Colombia			NA	NA	NA	NA	1	1	1860-01-01	1860	1	1	1860.01.01	NA			study skin	'New Grenada'	From the collection of Frank S. Wright.  Numbers 167 and 2546 are recorded on the original label.	NA	NA	NA	NA	NA	NA
CUMV	NA	5182	NA	H. Parzudaki		NA	Trochilidae	Heliangelus	exortis		Heliangelus	exortis	NA	female	immature	Colombia			NA	NA	NA	NA	1	1	1860-01-01	1860	1	1	1860.01.01	NA			study skin		From the collection of Frank S. Wright.  Numbers 470 and 15/14 are recorded on the original label from the Museum Boucard.	NA	NA	NA	NA	NA	NA
CUMV	NA	5902	NA	H. E. M. James		NA	Bucconidae	Malacoptila	mystacalis		Malacoptila	mystacalis	NA	undetermined		Colombia			NA	NA	NA	NA	1	1	1860-01-01	1860	1	1	1860.01.01	NA			study skin; unknown		From the collection of Frank S Wright.	NA	NA	NA	NA	NA	NA
CUMV	NA	4488	NA			NA	Trochilidae	Florisuga	mellivora		Florisuga	mellivora	NA	male		Colombia			NA	NA	NA	NA	1	1	1860-01-01	1860	1	1	1860.01.01	NA			study skin		From the collection of Frank S. Wright.  Previously from the collection of H.K. Coale; No. 16433.	NA	NA	NA	NA	NA	NA
CUMV	NA	4521	NA			NA	Trochilidae	Amazilia	franciae		Amazilia	franciae	NA	male		Colombia			NA	NA	NA	NA	1	1	1860-01-01	1860	1	1	1860.01.01	NA			study skin		From the collection of Frank S. Wright.  The number 2796 is recorded on the original label.	NA	NA	NA	NA	NA	NA
CUMV	NA	4529	NA			NA	Trochilidae	Amazilia	cyanifrons		Amazilia	cyanifrons	NA	male		Colombia			NA	NA	NA	NA	1	1	1860-01-01	1860	1	1	1860.01.01	NA			study skin		From the collection of Frank S. Wright.  Previously from the collection of H.K. Coale, No. 19694.	NA	NA	NA	NA	NA	NA
CUMV	NA	4531	NA			NA	Trochilidae	Amazilia	cyanifrons		Amazilia	cyanifrons	NA	female		Colombia			NA	NA	NA	NA	1	1	1860-01-01	1860	1	1	1860.01.01	NA			study skin		From the colleciton of H.K. Coale, No. 19695.	NA	NA	NA	NA	NA	NA
CUMV	NA	4659	NA			NA	Trochilidae	Chlorostilbon	gibsoni		Chlorostilbon	gibsoni	NA	male		Colombia			NA	NA	NA	NA	1	1	1860-01-01	1860	1	1	1860.01.01	NA			study skin		From the collection of Louis Agassiz Fuertes.  Previously from the collection of H.K. Coale, No. 17926.	NA	NA	NA	NA	NA	NA
CUMV	NA	4731	NA			NA	Trochilidae	Chalybura	buffonii		Chalybura	buffonii	NA	male		Colombia			NA	NA	NA	NA	1	1	1860-01-01	1860	1	1	1860.01.01	NA			study skin		Eyelashes light brown.; From the collection of Frank S. Wright.  Previously from the collection of H.K. Coale; No. 16423.	NA	NA	NA	NA	NA	NA
CUMV	NA	4974	NA			NA	Trochilidae	Heliodoxa	leadbeateri	leadbeateri	Heliodoxa	leadbeateri	NA	female		Colombia			NA	NA	NA	NA	1	1	1860-01-01	1860	1	1	1860.01.01	NA			study skin		From the colleciton of Louis Agassiz Fuertes.  Previously from the collection of H.K. Coale, No. 16991.	NA	NA	NA	NA	NA	NA
CUMV	NA	4975	NA			NA	Trochilidae	Heliodoxa	leadbeateri	leadbeateri	Heliodoxa	leadbeateri	NA	male		Colombia			NA	NA	NA	NA	1	1	1860-01-01	1860	1	1	1860.01.01	NA			study skin		From the collection of Frank S. Wright.	NA	NA	NA	NA	NA	NA
CUMV	NA	4991	NA			NA	Trochilidae	Coeligena	bonapartei		Coeligena	bonapartei	NA	male		Colombia			NA	NA	NA	NA	1	1	1860-01-01	1860	1	1	1860.01.01	NA			study skin		From the collection of Frank S. Wright.  Exchanged to Carleton College, 1942.	NA	NA	NA	NA	NA	NA
CUMV	NA	5013	NA			NA	Trochilidae	Coeligena	helianthea		Coeligena	helianthea	NA	male		Colombia			NA	NA	NA	NA	1	1	1860-01-01	1860	1	1	1860.01.01	NA			study skin		From the collection of Frank S. Wright.  Previously from the collection of H.K. Coale, No. 19658.	NA	NA	NA	NA	NA	NA
CUMV	NA	5016	NA			NA	Trochilidae	Coeligena	helianthea		Coeligena	helianthea	NA	male		Colombia			NA	NA	NA	NA	1	1	1860-01-01	1860	1	1	1860.01.01	NA			study skin		Numbers 170 and 470 are recorded on the original label from the Museum Boucard.	NA	NA	NA	NA	NA	NA
CUMV	NA	5041	NA			NA	Trochilidae	Lafresnaya	lafresnayi		Lafresnaya	lafresnayi	NA	male		Colombia			NA	NA	NA	NA	1	1	1860-01-01	1860	1	1	1860.01.01	NA			study skin		From the collection of Frank S. Wright.  Number 470 is recorded on the original label from the Museum Boucard.	NA	NA	NA	NA	NA	NA
CUMV	NA	5060	NA			NA	Trochilidae	Aglaeactis	cupripennis		Aglaeactis	cupripennis	NA	male		Colombia			NA	NA	NA	NA	1	1	1860-01-01	1860	1	1	1860.01.01	NA			study skin		From the collection of Louis Agassiz Fuertes.	NA	NA	NA	NA	NA	NA
CUMV	NA	5077	NA			NA	Trochilidae	Boissonneaua	flavescens		Boissonneaua	flavescens	NA	male		Colombia			NA	NA	NA	NA	1	1	1860-01-01	1860	1	1	1860.01.01	NA			study skin		From the collection of Frank S. Wright.  Previously from the collection of H.K. Coale, No. 27038.	NA	NA	NA	NA	NA	NA
CUMV	NA	5101	NA			NA	Trochilidae	Eriocnemis	vestitus	vestitus	Eriocnemis	vestita	NA	female		Colombia			NA	NA	NA	NA	1	1	1860-01-01	1860	1	1	1860.01.01	NA			study skin		From the collection of Louis Agassiz Fuertes.  Previously from the Carpenter Collection.	NA	NA	NA	NA	NA	NA
CUMV	NA	5116	NA			NA	Trochilidae	Eriocnemis	cupreoventris		Eriocnemis	cupreoventris	NA	in question		Colombia			NA	NA	NA	NA	1	1	1860-01-01	1860	1	1	1860.01.01	NA			study skin		From the collection of Frank S. Wright.  Previously from the collection of H.K. Coale, No. 16499.	NA	NA	NA	NA	NA	NA
CUMV	NA	5159	NA			NA	Trochilidae	Heliangelus	amethysticollis	clarisse	Heliangelus	amethysticollis	NA	in question	immature	Colombia			NA	NA	NA	NA	1	1	1860-01-01	1860	1	1	1860.01.01	NA			study skin		From the collection of Louis Agassiz Fuertes.  Previously from the Carpenter Collection.	NA	NA	NA	NA	NA	NA
CUMV	NA	5163	NA			NA	Trochilidae	Heliangelus	amethysticollis	clarisse	Heliangelus	amethysticollis	NA	male	immature	Colombia			NA	NA	NA	NA	1	1	1860-01-01	1860	1	1	1860.01.01	NA			study skin		From the collection of Frank S. Wright. Previously from the collection of H.K. Coale, No. 19653.	NA	NA	NA	NA	NA	NA
CUMV	NA	5174	NA	Louis Agassiz Fuertes	LAF 3087	NA	Trochilidae	Heliangelus	exortis		Heliangelus	exortis	NA	male		Colombia	Cundinamarca	El Roble, Posada above Aguadita [Elevation 7850 feet]	NA	NA	NA	NA	1	1	1860-01-01	1860	1	1	1860.01.01	NA	Testes not enlarged.		study skin		Measurements with incomplete labels.  W: 64.5 mm T: 50.5 C: 14.5; From the collection of Louis Agassiz Fuertes.	NA	NA	NA	NA	NA	NA
CUMV	NA	5179	NA			NA	Trochilidae	Heliangelus	exortis		Heliangelus	exortis	NA	in question		Colombia			NA	NA	NA	NA	1	1	1860-01-01	1860	1	1	1860.01.01	NA			study skin		From the collection of H.K. Coale, No. 16968.	NA	NA	NA	NA	NA	NA
CUMV	NA	5237	NA			NA	Trochilidae	Aglaiocercus	kingi		Aglaiocercus	kingii	NA	female		Colombia			NA	NA	NA	NA	1	1	1860-01-01	1860	1	1	1860.01.01	NA			study skin		From the collection of Frank S. Wright.  Number 93/1 is recorded on an earlier label.	NA	NA	NA	NA	NA	NA
CUMV	NA	5244	NA			NA	Trochilidae	Aglaiocercus	kingi	margarethae	Aglaiocercus	kingii	NA	female		Colombia			NA	NA	NA	NA	1	1	1860-01-01	1860	1	1	1860.01.01	NA			study skin		From the collection of Frank S. Wright.  Number 93/2 is recorded on an earlier label.	NA	NA	NA	NA	NA	NA
CUMV	NA	5465	NA			NA	Trochilidae	Discosura	conversii	conversii	Discosura	conversii	NA	female		Colombia			NA	NA	NA	NA	1	1	1860-01-01	1860	1	1	1860.01.01	NA			study skin		From the collection of Frank S. Wright.  Imported by W.F.H. Rosenberg, 57, Haverstock Hill, London. The number 2061 is recorded on the original label.	NA	NA	NA	NA	NA	NA
CUMV	NA	5497	NA			NA	Trogonidae	Trogon	collaris	collaris	Trogon	collaris	NA	male		Colombia			NA	NA	NA	NA	1	1	1860-01-01	1860	1	1	1860.01.01	NA			study skin		From the collection of Frank S. Wright.  Number 470 is recorded on the original label from the Museum Boucard.	NA	NA	NA	NA	NA	NA
CUMV	NA	5728	NA			NA	Momotidae	Momotus	momota	microstephanus	Momotus	momota	NA	male		Colombia			NA	NA	NA	NA	1	1	1860-01-01	1860	1	1	1860.01.01	NA			study skin		From the collection of Frank S. Wright.  Number 470 is recorded on the original label from the Museum Boucard.	NA	NA	NA	NA	NA	NA
CUMV	NA	6294	NA			NA	Picidae	Melanerpes	flavigula		Melanerpes	formicivorus	NA	male		Colombia			NA	NA	NA	NA	1	1	1860-01-01	1860	1	1	1860.01.01	NA			study skin		From the collection of Frank S Wright.	NA	NA	NA	NA	NA	NA
CUMV	NA	7248	NA			NA	Cotingidae	Ampelion	rubrocristata		Ampelion	rubrocristatus	NA			Colombia			NA	NA	NA	NA	1	1	1860-01-01	1860	1	1	1860.01.01	NA			study skin		From the collection of Frank S Wright. From the collection of Henry K Coale #27196.	NA	NA	NA	NA	NA	NA
CUMV	NA	7437	NA			NA	Pipridae	Masius	chrysopterus	chrysopterus	Masius	chrysopterus	NA	male		Colombia			NA	NA	NA	NA	1	1	1860-01-01	1860	1	1	1860.01.01	NA			study skin		From the collection of Frank S Wright.	NA	NA	NA	NA	NA	NA
CUMV	NA	14025	NA			NA	Turdidae	Turdus	fuscater	quindio	Turdus	fuscater	NA	male		Colombia	Huila		NA	NA	NA	NA	1	1	1860-01-01	1860	1	1	1860.01.01	NA			study skin		From the collection of Frank S Wright.	NA	NA	NA	NA	NA	NA
CUMV	NA	15799	NA			NA	Thamnophilidae	Hylophilus	semibrunneus		Pachysylvia	semibrunnea	NA	undetermined		Colombia			NA	NA	NA	NA	1	1	1860-01-01	1860	1	1	1860.01.01	NA			study skin		From the collection of Frank S Wright.	NA	NA	NA	NA	NA	NA
CUMV	NA	15821	NA			NA	Thraupidae	Diglossa	albilatera		Diglossa	albilatera	NA			Colombia			NA	NA	NA	NA	1	1	1860-01-01	1860	1	1	1860.01.01	NA			study skin		From the collection of Frank S Wright.	NA	NA	NA	NA	NA	NA
CUMV	NA	15868	NA			NA	Thraupidae	Cyanerpes	cyaneus		Cyanerpes	cyaneus	NA	male		Colombia			NA	NA	NA	NA	1	1	1860-01-01	1860	1	1	1860.01.01	NA			study skin			NA	NA	NA	NA	NA	NA
CUMV	NA	18103	NA			NA	Icteridae	Psarocolius	yuracares		Psarocolius	bifasciatus	NA	male		Colombia			NA	NA	NA	NA	1	1	1860-01-01	1860	1	1	1860.01.01	NA			study skin		From the collection of Frank S Wright.	NA	NA	NA	NA	NA	NA
CUMV	NA	22816	NA			NA	Thraupidae	Tangara	chilensis		Tangara	chilensis	NA	male		Colombia			NA	NA	NA	NA	1	1	1860-01-01	1860	1	1	1860.01.01	NA			study skin		From the collection of Frank S Wright.	NA	NA	NA	NA	NA	NA
CUMV	NA	22954	NA			NA	Thraupidae	Ramphocelus	flammigerus		Ramphocelus	flammigerus	NA	male		Colombia			NA	NA	NA	NA	1	1	1860-01-01	1860	1	1	1860.01.01	NA			study skin		From the collection of Frank S Wright.	NA	NA	NA	NA	NA	NA
CUMV	NA	23019	NA			NA	Thraupidae	Hemithraupis	flavicollis		Hemithraupis	flavicollis	NA			Colombia			NA	NA	NA	NA	1	1	1860-01-01	1860	1	1	1860.01.01	NA			study skin		From the collection of Frank S Wright.	NA	NA	NA	NA	NA	NA
CUMV	NA	4526	NA			NA	Trochilidae	Lepidopyga	goudoti		Lepidopyga	goudoti	NA	female		Colombia			NA	NA	NA	NA	1	1	1860-01-01	1860	1	1	1860.01.01	NA			study skin		From the collection of Frank S. Wright.  Previously from the collection of H.K. Coale, No. 17089; Brodkorb No. 4093.	NA	NA	NA	NA	NA	NA
CUMV	NA	4445	NA			NA	Trochilidae	Phaethornis	anthophilus		Phaethornis	anthophilus	NA	female		Colombia			NA	NA	NA	NA	1	1	1860-01-01	1860	1	1	1860.01.01	NA			study skin		From the collection of Frank S. Wright.	NA	NA	NA	NA	NA	NA
CUMV	NA	4671	NA			NA	Trochilidae	Chlorostilbon	poortmani		Chlorostilbon	poortmani	NA	male	immature	Colombia			NA	NA	NA	NA	1	1	1860-01-01	1860	1	1	1860.01.01	NA			study skin		From the collection of Frank S. Wright.  Previously from the collection of H.K. Coale, No. 19733.	NA	NA	NA	NA	NA	NA
CUMV	NA	5118	NA			NA	Trochilidae	Haplophaedia	aureliae	aureliae	Haplophaedia	aureliae	NA	male		Colombia			NA	NA	NA	NA	1	1	1860-01-01	1860	1	1	1860.01.01	NA			study skin		From the collection of Louis Agassiz Fuertes.  Previously from the collection of H.K. Coale, No. 16455.	NA	NA	NA	NA	NA	NA
CUMV	NA	5196	NA			NA	Trochilidae	Metallura	tyrianthina	tyrianthina	Metallura	tyrianthina	NA	male		Colombia			NA	NA	NA	NA	1	1	1860-01-01	1860	1	1	1860.01.01	NA			study skin		Throat greenish- no black.; From the collection of H.K. Coale, No. 17023.	NA	NA	NA	NA	NA	NA
CUMV	NA	5235	NA			NA	Trochilidae	Aglaiocercus	kingi	kingi	Aglaiocercus	kingii	NA	male		Colombia			NA	NA	NA	NA	1	1	1860-01-01	1860	1	1	1860.01.01	NA			study skin		From the collection of Frank S. Wright.  Number 470 is recorded on the original label from the Museum Boucard.	NA	NA	NA	NA	NA	NA
CUMV	NA	4882	NA			NA	Trochilidae	Anthracothorax	nigricollis		Anthracothorax	nigricollis	NA	male		Colombia			NA	NA	NA	NA	1	1	1860-01-01	1860	1	1	1860.01.01	NA			study skin		Eyelashes black.; From the collection of Frank S. Wright.  Previously from the collection of H.K. Coale, No. 16458.  The number 15/83 is also recorded on the original label.	NA	NA	NA	NA	NA	NA
CUMV	NA	5463	NA			NA	Trochilidae	Discosura	langsdorffi		Discosura	langsdorffi	NA	female		Colombia			NA	NA	NA	NA	1	1	1860-01-01	1860	1	1	1860.01.01	NA			study skin		From the collection of Frank S. Wright.  The number 470 is recorded on the original label which is from the Museum Boucard.	NA	NA	NA	NA	NA	NA
CUMV	NA	5214	NA			NA	Trochilidae	Chalcostigma	heteropogon		Chalcostigma	heteropogon	NA	male		Colombia			NA	NA	NA	NA	1	1	1860-01-01	1860	1	1	1860.01.01	NA			study skin		From the collection of Frank S. Wright.  Numbers 15/16 and 470 are recorded on the original label from the Museum Boucard.	NA	NA	NA	NA	NA	NA
CUMV	NA	15909	NA			NA	Thraupidae	Dacnis	egregia		Dacnis	lineata	NA	male		Colombia			NA	NA	NA	NA	1	1	1860-01-01	1860	1	1	1860.01.01	NA			study skin		From the collection of Frank S Wright.	NA	NA	NA	NA	NA	NA
CUMV	NA	15850	NA			NA	Thraupidae	Cyanerpes	caeruleus		Cyanerpes	caeruleus	NA	male		Colombia			NA	NA	NA	NA	1	1	1860-01-01	1860	1	1	1860.01.01	NA			study skin			NA	NA	NA	NA	NA	NA
CUMV	NA	4553	NA			NA	Trochilidae	Amazilia	viridigaster		Amazilia	viridigaster	NA	male		Colombia			NA	NA	NA	NA	1	1	1860-01-01	1860	1	1	1860.01.01	NA			study skin		Eyelaskes dark brown.; From the collection of Frank S. Wright.  Previously from the collection of H.K. Coale, No. 16434.	NA	NA	NA	NA	NA	NA
CUMV	NA	5058	NA			NA	Trochilidae	Pterophanes	cyanopterus	temmincki	Pterophanes	cyanopterus	NA	female		Colombia			NA	NA	NA	NA	1	1	1860-01-01	1860	1	1	1860.01.01	NA			study skin		From the collection of Frank S. Wright.  Previously from the collection of H.K. Coale, No. 27229.	NA	NA	NA	NA	NA	NA
CUMV	NA	5133	NA			NA	Trochilidae	Ocreatus	underwoodii	underwoodi	Ocreatus	underwoodii	NA	male		Colombia			NA	NA	NA	NA	1	1	1860-01-01	1860	1	1	1860.01.01	NA			study skin		From the collection of Frank S. Wright.	NA	NA	NA	NA	NA	NA
CUMV	NA	5234	NA			NA	Trochilidae	Aglaiocercus	kingi	kingi	Aglaiocercus	kingii	NA	male		Colombia			NA	NA	NA	NA	1	1	1860-01-01	1860	1	1	1860.01.01	NA			study skin		From the collection of Frank S. Wright.  Number 2796 is recorded on the original label.	NA	NA	NA	NA	NA	NA
CUMV	NA	7194	NA			NA	Formicariidae	Grallaria	squamigera	squamigera	Grallaria	squamigera	NA	undetermined		Colombia		Andes Mountains	NA	NA	NA	NA	1	1	1860-01-01	1860	1	1	1860.01.01	NA			study skin		From the collection of Louis Agassiz Fuertes. From the Carpenter collection.	NA	NA	NA	NA	NA	NA
CUMV	NA	10519	NA			NA	Corvidae	Cyanocorax	yncas		Cyanocorax	yncas	NA	male		Colombia			NA	NA	NA	NA	1	1	1860-01-01	1860	1	1	1860.01.01	NA			study skin		From the collection of Frank S Wright.	NA	NA	NA	NA	NA	NA
CUMV	NA	5183	NA			NA	Trochilidae	Heliangelus	exortis		Heliangelus	exortis	NA	female	immature	Colombia			NA	NA	NA	NA	1	1	1860-01-01	1860	1	1	1860.01.01	NA			study skin		From the collection of Frank S. Wright.  Numbers 2937 and 60 are recorded on the original label from the Manchester Museum.	NA	NA	NA	NA	NA	NA
CUMV	NA	15835	NA			NA	Thraupidae	Diglossa	sittoides		Diglossa	sittoides	NA			Colombia			NA	NA	NA	NA	1	1	1860-01-01	1860	1	1	1860.01.01	NA			study skin		From the collection of Frank S Wright.	NA	NA	NA	NA	NA	NA
CUMV	NA	4551	NA			NA	Trochilidae	Amazilia	viridigaster		Amazilia	viridigaster	NA	female		Colombia			NA	NA	NA	NA	1	1	1860-01-01	1860	1	1	1860.01.01	NA			study skin		From the collection of Frank S. Wright.  Previously from the collection of H.K. Coale, No. 19679.	NA	NA	NA	NA	NA	NA
CUMV	NA	22920	NA			NA	Thraupidae	Tangara	cyanoptera		Stilpnia	cyanoptera	NA			Colombia			NA	NA	NA	NA	1	1	1860-01-01	1860	1	1	1860.01.01	NA			study skin			NA	NA	NA	NA	NA	NA
CUMV	NA	4672	NA			NA	Trochilidae	Chlorostilbon	poortmani		Chlorostilbon	poortmani	NA	male		Colombia			NA	NA	NA	NA	1	1	1860-01-01	1860	1	1	1860.01.01	NA			study skin		From the collection of Louis Agassiz Fuertes.  Previously from the Carpenter Collection.	NA	NA	NA	NA	NA	NA
CUMV	NA	4733	NA			NA	Trochilidae	Chalybura	buffonii	caeruleogaster	Chalybura	buffonii	NA	male		Colombia			NA	NA	NA	NA	1	1	1860-01-01	1860	1	1	1860.01.01	NA			study skin		From the collection of Frank S. Wright.  Previously from the collection of H.K. Coale; No. 17039. Brodkorb No. 4092.	NA	NA	NA	NA	NA	NA
CUMV	NA	5177	NA			NA	Trochilidae	Heliangelus	exortis		Heliangelus	exortis	NA	male		Colombia			NA	NA	NA	NA	1	1	1860-01-01	1860	1	1	1860.01.01	NA			study skin		From the collection of Frank S. Wright.  Previously from the collection of H.K. Coale, No. 17231.	NA	NA	NA	NA	NA	NA
CUMV	NA	4626	NA			NA	Trochilidae	Chrysuronia	oenone	longirostris	Chrysuronia	oenone	NA	male		Colombia			NA	NA	NA	NA	1	1	1860-01-01	1860	1	1	1860.01.01	NA			study skin		From the collection of Frank S. Wright.  The number 15/115 is also recorded on the original label.	NA	NA	NA	NA	NA	NA
CUMV	NA	4714	NA			NA	Trochilidae	Thalurania	furcata		Thalurania	furcata	NA	male		Colombia			NA	NA	NA	NA	1	1	1860-01-01	1860	1	1	1860.01.01	NA			study skin		From the collection of Frank S. Wright.  Previously from the collection of H.K. Coale, No. 19699.	NA	NA	NA	NA	NA	NA
CUMV	NA	13128	NA			NA	Troglodytidae	Henicorhina	leucosticta		Henicorhina	leucosticta	NA			Colombia			NA	NA	NA	NA	1	1	1860-01-01	1860	1	1	1860.01.01	NA			study skin			NA	NA	NA	NA	NA	NA
CUMV	NA	5282	NA			NA	Trochilidae	Heliomaster	longirostris	longirostris	Heliomaster	longirostris	NA	female		Colombia			NA	NA	NA	NA	1	1	1860-01-01	1860	1	1	1860.01.01	NA			study skin		From the collection of Frank S. Wright.  Previously from the collection of H.K. Coale, No. 28939.  Imported by W.F.H. Rosenberg, London.	NA	NA	NA	NA	NA	NA
CUMV	NA	15845	NA			NA	Thraupidae	Diglossa	caerulescens		Diglossa	caerulescens	NA	female		Colombia			NA	NA	NA	NA	1	1	1860-01-01	1860	1	1	1860.01.01	NA			study skin		From the collection of Frank S Wright.	NA	NA	NA	NA	NA	NA
CUMV	NA	15915	NA			NA	Thraupidae	Chlorophanes	spiza		Chlorophanes	spiza	NA	male		Colombia			NA	NA	NA	NA	1	1	1860-01-01	1860	1	1	1860.01.01	NA			study skin			NA	NA	NA	NA	NA	NA
CUMV	NA	23001	NA			NA	Thraupidae	Tachyphonus	luctuosus		Tachyphonus	luctuosus	NA	male		Colombia			NA	NA	NA	NA	1	1	1860-01-01	1860	1	1	1860.01.01	NA			study skin		From the collection of Frank S Wright.	NA	NA	NA	NA	NA	NA
CUMV	NA	5103	NA			NA	Trochilidae	Eriocnemis	vestitus	vestitus	Eriocnemis	vestita	NA	male		Colombia			NA	NA	NA	NA	1	1	1860-01-01	1860	1	1	1860.01.01	NA			study skin		From the collection of H.K. Coale, No. 16447.	NA	NA	NA	NA	NA	NA
CUMV	NA	22882	NA			NA	Thraupidae	Tangara	inornata		Tangara	inornata	NA			Colombia	Cundinamarca	Bogota; istrito Capital de	NA	NA	4.609866	-74.08205	NA	NA	1866	1866	NA	NA	1866.NA.NA	NA			study skin		From the collection of Frank S Wright.	NA	NA	NA	NA	NA	NA
CUMV	NA	22863	NA			NA	Thraupidae	Tangara	nigrocincta		Stilpnia	nigrocincta	NA			Colombia	Cundinamarca	Bogota; istrito Capital de	NA	NA	4.609866	-74.08205	NA	NA	1875	1875	NA	NA	1875.NA.NA	NA			study skin		From the collection of Frank S Wright.	NA	NA	NA	NA	NA	NA
CUMV	NA	20954	NA			NA	Thraupidae	Bangsia	montana		Buthraupis	montana	NA	undetermined		Colombia	Cundinamarca	Bogota; istrito Capital de	NA	NA	4.609866	-74.08205	NA	NA	1885	1885	NA	NA	1885.NA.NA	NA			study skin		From the collection of Frank S Wright.	NA	NA	NA	NA	NA	NA
CUMV	NA	19060	NA			NA	Emberizidae	Atlapetes	schistaceus		Atlapetes	schistaceus	NA	male		Colombia	Cundinamarca	Bogota; istrito Capital de	NA	NA	4.609866	-74.08205	NA	NA	1886	1886	NA	NA	1886.NA.NA	NA			study skin		From the collection of Frank S Wright.	NA	NA	NA	NA	NA	NA
CUMV	NA	7084	NA			NA	Thamnophilidae	Myrmotherula	axillaris	melaena	Myrmotherula	axillaris	NA	male		Colombia			NA	NA	NA	NA	NA	NA	1886	1886	NA	NA	1886.NA.NA	NA			study skin		From the collection of Frank S Wright.	NA	NA	NA	NA	NA	NA
CUMV	NA	7110	NA			NA	Thamnophilidae	Cercomacra	tyrannina	rufiventris	Cercomacroides	tyrannina	NA	female		Colombia			NA	NA	NA	NA	NA	NA	1886	1886	NA	NA	1886.NA.NA	NA			study skin		From the collection of Frank S Wright.	NA	NA	NA	NA	NA	NA
CUMV	NA	14803	NA			NA	Vireonidae	Cyclarhis	gujanensis		Cyclarhis	gujanensis	NA	male		Colombia			NA	NA	NA	NA	NA	NA	1886	1886	NA	NA	1886.NA.NA	NA			study skin		From the collection of Frank S Wright.	NA	NA	NA	NA	NA	NA
CUMV	NA	22999	NA			NA	Icteridae	Molothrus	surinamus		NA	NA	NA	in question		Colombia			NA	NA	NA	NA	NA	NA	1886	1886	NA	NA	1886.NA.NA	NA			study skin		From the collection of Frank S Wright.	NA	NA	NA	NA	NA	NA
CUMV	NA	23038	NA			NA	Thraupidae	Chlorospingus	flavopectus		Chlorospingus	flavopectus	NA			Colombia			NA	NA	NA	NA	NA	NA	1886	1886	NA	NA	1886.NA.NA	NA			study skin		From the collection of Frank S Wright.	NA	NA	NA	NA	NA	NA
CUMV	NA	23020	NA			NA	Thraupidae	Hemithraupis	flavicollis		Hemithraupis	flavicollis	NA	female		Colombia			NA	NA	NA	NA	NA	NA	1886	1886	NA	NA	1886.NA.NA	NA			study skin		From the collection of Frank S Wright.	NA	NA	NA	NA	NA	NA
CUMV	NA	15930	NA			NA	Thraupidae	Conirostrum	sitticolor		Conirostrum	sitticolor	NA	male		Colombia			NA	NA	NA	NA	NA	NA	1887	1887	NA	NA	1887.NA.NA	NA			study skin			NA	NA	NA	NA	NA	NA
CUMV	NA	18604	NA			NA	Emberizidae	Sporophila	luctuosa		Sporophila	luctuosa	NA	male		Colombia			NA	NA	NA	NA	NA	NA	1887	1887	NA	NA	1887.NA.NA	NA			study skin		From the collection of Frank S Wright.	NA	NA	NA	NA	NA	NA
CUMV	NA	4454	NA			NA	Trochilidae	Eutoxeres	aquila		Eutoxeres	aquila	NA	male		Colombia			NA	NA	NA	NA	NA	NA	1887	1887	NA	NA	1887.NA.NA	NA			study skin		From the collection of Frank S. Wright.	NA	NA	NA	NA	NA	NA
CUMV	NA	4640	NA			NA	Trochilidae	Damophila	julie	julie	Juliamyia	julie	NA	female		Colombia			NA	NA	NA	NA	NA	NA	1888	1888	NA	NA	1888.NA.NA	NA			study skin		From the collection of Frank S. Wright.  Previously from the collection of H.K. Coale, No. 28949; Brodkorb No. 4095.	NA	NA	NA	NA	NA	NA
CUMV	NA	4678	NA			NA	Trochilidae	Chlorostilbon	poortmani		Chlorostilbon	poortmani	NA	male		Colombia			NA	NA	NA	NA	NA	NA	1888	1888	NA	NA	1888.NA.NA	NA			study skin		From the collection of Frank S. Wright.  Previously from the collection of H.K. Coale, No. 25865.	NA	NA	NA	NA	NA	NA
CUMV	NA	4700	NA			NA	Trochilidae	Thalurania	colombica	colombica	Thalurania	colombica	NA	female		Colombia			NA	NA	NA	NA	NA	NA	1888	1888	NA	NA	1888.NA.NA	NA			study skin		From the collection of Frank S. Wright.  [60f] is also recorded on a previous label from the Museum Boucard.	NA	NA	NA	NA	NA	NA
CUMV	NA	7579	NA			NA	Tyrannidae	Fluvicola	pica	pica	Fluvicola	pica	NA	female		Colombia			NA	NA	NA	NA	NA	NA	1888	1888	NA	NA	1888.NA.NA	NA			study skin		From the collection of Frank S Wright. From the collection of Henry K Coale #11307.	NA	NA	NA	NA	NA	NA
CUMV	NA	7464	NA			NA	Pipridae	Manacus	manacus	flaviolus	Manacus	manacus	NA	male		Colombia			NA	NA	NA	NA	NA	NA	1888	1888	NA	NA	1888.NA.NA	NA			study skin		From the collection of Frank S Wright.	NA	NA	NA	NA	NA	NA
CUMV	NA	4625	NA			NA	Trochilidae	Chrysuronia	oenone	longirostris	Chrysuronia	oenone	NA	female		Colombia			NA	NA	NA	NA	NA	NA	1888	1888	NA	NA	1888.NA.NA	NA			study skin		From the collection of Frank S. Wright.  Previously from the collection of H.K. Coale, No. 25877.	NA	NA	NA	NA	NA	NA
CUMV	NA	4446	NA			NA	Trochilidae	Phaethornis	hispidus	oseryi	Phaethornis	hispidus	NA	male		Colombia			NA	NA	NA	NA	NA	NA	1888	1888	NA	NA	1888.NA.NA	NA			study skin		From the collection of Frank S. Wright.	NA	NA	NA	NA	NA	NA
CUMV	NA	7426	NA			NA	Pipridae	Machaeropterus	regulus	regulus	Machaeropterus	regulus	NA	female	immature	Colombia			NA	NA	NA	NA	NA	NA	1888	1888	NA	NA	1888.NA.NA	NA			study skin		From the collection of Frank S Wright.	NA	NA	NA	NA	NA	NA
CUMV	NA	12943	NA		FSW 15150	NA	Troglodytidae	Troglodytes	aedon	striatulus	Troglodytes	aedon	NA	female		Colombia			NA	NA	NA	NA	NA	NA	1888	1888	NA	NA	1888.NA.NA	NA			study skin		From the collection of Frank S Wright.	NA	NA	NA	NA	NA	NA
CUMV	NA	4576	NA			NA	Trochilidae	Amazilia	tzacatl	jucunda	Amazilia	tzacatl	NA	male		Colombia			NA	NA	NA	NA	NA	NA	1888	1888	NA	NA	1888.NA.NA	NA			study skin		From the collection of Frank S. Wright.  Previously from the collection of H.K. Coale; No. 26398.	NA	NA	NA	NA	NA	NA
CUMV	NA	4554	NA			NA	Trochilidae	Amazilia	viridigaster		Amazilia	viridigaster	NA			Colombia			NA	NA	NA	NA	NA	NA	1888	1888	NA	NA	1888.NA.NA	NA			study skin		From the collection of Frank S. Wright.  The number 470 is recorded on the original label from the Museum Boucard, along with the following:  :'absolument semblable au type euroye par Berlynch, cu 1888.'	NA	NA	NA	NA	NA	NA
CUMV	NA	12942	NA		FSW 1566	NA	Troglodytidae	Troglodytes	aedon	striatulus	Troglodytes	aedon	NA			Colombia			NA	NA	NA	NA	NA	NA	1888	1888	NA	NA	1888.NA.NA	NA			study skin		From the collection of Frank S Wright.	NA	NA	NA	NA	NA	NA
CUMV	NA	22886	NA			NA	Thraupidae	Tangara	gyrola		Tangara	gyrola	NA	male		Colombia	Cundinamarca	Bogota; istrito Capital de	NA	NA	4.609866	-74.08205	NA	NA	1890	1890	NA	NA	1890.NA.NA	NA			study skin		From the collection of Frank S Wright.	NA	NA	NA	NA	NA	NA
CUMV	NA	7137	NA			NA	Thamnophilidae	Myrmeciza	longipes	boucardi	Myrmeciza	longipes	NA	male		Colombia			NA	NA	NA	NA	NA	NA	1891	1891	NA	NA	1891.NA.NA	NA			study skin		From the collection of Frank S Wright.	NA	NA	NA	NA	NA	NA
CUMV	NA	7136	NA			NA	Thamnophilidae	Myrmeciza	longipes	boucardi	Myrmeciza	longipes	NA	female		Colombia			NA	NA	NA	NA	NA	NA	1891	1891	NA	NA	1891.NA.NA	NA			study skin		From the collection of Frank S Wright.	NA	NA	NA	NA	NA	NA
CUMV	NA	7463	NA			NA	Pipridae	Manacus	manacus	flaviolus	Manacus	manacus	NA	male		Colombia			NA	NA	NA	NA	NA	NA	1891	1891	NA	NA	1891.NA.NA	NA			study skin		From the collection of Frank S Wright. From the collection of Henry K Coale #23673. From the collection of Pierce Brodkorb #4017.	NA	NA	NA	NA	NA	NA
CUMV	NA	5197	NA			NA	Trochilidae	Metallura	tyrianthina	tyrianthina	Metallura	tyrianthina	NA	male	immature	Colombia			NA	NA	NA	NA	94	94	1897-04-04	1897	4	4	1897.04.04	NA			study skin		From the collection of Frank S. Wright.	NA	NA	NA	NA	NA	NA
CUMV	NA	18088	NA			NA	Icteridae	Psarocolius	decumanus		Psarocolius	decumanus	NA	male		Colombia			NA	NA	NA	NA	NA	NA	1897	1897	NA	NA	1897.NA.NA	NA			study skin		From the collection of Frank S Wright.	NA	NA	NA	NA	NA	NA
CUMV	NA	22810	NA	J. H. Batty		NA	Thraupidae	Chlorochrysa	nitidissima		Chlorochrysa	nitidissima	NA	male		Colombia		Castillo	NA	NA	NA	NA	176	176	1898-06-25	1898	6	25	1898.06.25	NA			study skin			NA	NA	NA	NA	NA	NA
CUMV	NA	22955	NA	J. H. Batty		NA	Thraupidae	Ramphocelus	flammigerus		Ramphocelus	flammigerus	NA	male		Colombia		Rio Cauca	NA	NA	NA	NA	NA	NA	1898-06	1898	6	NA	1898.06.NA	NA			study skin			NA	NA	NA	NA	NA	NA
CUMV	NA	22989	NA			NA	Thraupidae	Habia	cristata		Habia	cristata	NA	male	immature	Colombia		Rio Lima	NA	NA	NA	NA	237	237	1898-08-25	1898	8	25	1898.08.25	NA			study skin		From the collection of Frank S Wright.	NA	NA	NA	NA	NA	NA
CUMV	NA	15729	NA	Smith		NA	Vireonidae	Vireo	olivaceus		Vireo	olivaceus	NA	female		Colombia		Santa Marta	NA	NA	NA	NA	269	269	1899-09-26	1899	9	26	1899.09.26	NA			study skin			NA	NA	NA	NA	NA	NA
CUMV	NA	5730	NA	J. H. Batty		NA	Momotidae	Momotus	momota	lessonii	Momotus	momota	NA	male		Colombia		Boqueron	NA	NA	NA	NA	324	324	11/20/01	1901	11	20	1901.11.20	NA			study skin			NA	NA	NA	NA	NA	NA
CUMV	NA	5755	NA	J. H. Batty		NA	Galbulidae	Galbula	melanogenia		Galbula	ruficauda	NA	male		Colombia		Boqueron	NA	NA	NA	NA	344	344	12/10/01	1901	12	10	1901.12.10	NA			study skin			NA	NA	NA	NA	NA	NA
CUMV	NA	16954	NA			NA	Parulidae	Myioborus	ornatus		Myioborus	ornatus	NA	male		Colombia	Cundinamarca	Bogota; istrito Capital de	NA	NA	4.609866	-74.08205	127	127	5/7/02	1902	5	7	1902.05.07	NA			study skin		From the collection of Frank S Wright.	NA	NA	NA	NA	NA	NA
CUMV	NA	5193	NA	H. Whitely		NA	Trochilidae	Metallura	tyrianthina	tyrianthina	Metallura	tyrianthina	NA	male		Colombia			NA	NA	NA	NA	NA	NA	1903-04	1903	4	NA	1903.04.NA	NA			study skin	'New Grenada'		NA	NA	NA	NA	NA	NA
CUMV	NA	15889	NA			NA	Thraupidae	Dacnis	angelica		NA	NA	NA	male		Colombia	Cundinamarca	Bogota; istrito Capital de	NA	NA	4.609866	-74.08205	138	138	5/18/03	1903	5	18	1903.05.18	NA			study skin		From the collection of Frank S Wright.	NA	NA	NA	NA	NA	NA
CUMV	NA	5178	NA			NA	Trochilidae	Heliangelus	exortis		Heliangelus	exortis	NA	male		Colombia			NA	NA	NA	NA	NA	NA	1903-06	1903	6	NA	1903.06.NA	NA			study skin		From the collection of Frank S. Wright.  Previously from the collection of H.K. Coale, No. 10037.	NA	NA	NA	NA	NA	NA
CUMV	NA	16990	NA			NA	Parulidae	Basileuterus	auricapillus		Basileuterus	culicivorus	NA	male		Colombia			NA	NA	NA	NA	231	231	8/19/03	1903	8	19	1903.08.19	NA			study skin		From the collection of Frank S Wright.	NA	NA	NA	NA	NA	NA
CUMV	NA	7510	NA			NA	Tyrannidae	Ochthoeca	cinnamomeiventris		Ochthoeca	cinnamomeiventris	NA	male		Colombia	Cundinamarca	Bogota; istrito Capital de	NA	NA	4.609866	-74.08205	NA	NA	1903	1903	NA	NA	1903.NA.NA	NA			study skin		From the collection of Frank S Wright.	NA	NA	NA	NA	NA	NA
CUMV	NA	8334	NA			NA	Tyrannidae	Mecocerculus	leucophrys	setophagoides	Mecocerculus	leucophrys	NA	female		Colombia	Cundinamarca	Bogota; istrito Capital de	NA	NA	4.609866	-74.08205	NA	NA	1903	1903	NA	NA	1903.NA.NA	NA			study skin		From the collection of Frank S Wright.	NA	NA	NA	NA	NA	NA
CUMV	NA	4522	NA			NA	Trochilidae	Amazilia	franciae		Amazilia	franciae	NA	female		Colombia			NA	NA	NA	NA	NA	NA	1903	1903	NA	NA	1903.NA.NA	NA			study skin		Eyelashes buffy white.; From the collection of Frank S. Wright.  Previously from the collection of H.K. Coale, No. 16417.	NA	NA	NA	NA	NA	NA
CUMV	NA	4655	NA			NA	Trochilidae	Chlorostilbon	gibsoni		Chlorostilbon	gibsoni	NA	male		Colombia			NA	NA	NA	NA	45	45	2/14/04	1904	2	14	1904.02.14	NA			study skin		From the collection of Louis Agassiz Fuertes.  Previously from the collection of H.K. Coale, No. 10026.	NA	NA	NA	NA	NA	NA
CUMV	NA	15754	NA			NA	Vireonidae	Vireo	olivaceus		Vireo	olivaceus	NA	female		Colombia		Jiminez	NA	NA	NA	NA	206	206	7/24/04	1904	7	24	1904.07.24	NA			study skin		From the collection of Frank S Wright.	NA	NA	NA	NA	NA	NA
CUMV	NA	4478	NA			NA	Trochilidae	Campylopterus	falcatus		Campylopterus	falcatus	NA	male		Colombia	Cundinamarca	Bogota; istrito Capital de	NA	NA	4.609866	-74.08205	170	170	6/19/05	1905	6	19	1905.06.19	NA			study skin		Note on original label:  'Shafts not as flat as 17058'.; From the collection of Frank S. Wright.  Previously from the collection of H.K. Coale, No. 10011.	NA	NA	NA	NA	NA	NA
CUMV	NA	4701	NA			NA	Trochilidae	Thalurania	colombica	colombica	Thalurania	colombica	NA	female		Colombia			NA	NA	NA	NA	NA	NA	1906-04	1906	4	NA	1906.04.NA	NA			study skin	'New Grenada'	Eyelashes black.; From the collection of H.K. Coale, No. 10030.	NA	NA	NA	NA	NA	NA
CUMV	NA	7582	NA	Mervyn G. Palmer		NA	Tyrannidae	Pyrocephalus	rubinus	obscurus	Pyrocephalus	rubinus	NA	male		Colombia		Atuncela, elevation 3000 ft.	NA	NA	NA	NA	169	169	6/18/07	1907	6	18	1907.06.18	NA		{colors:Bill color: dark brown; Leg color: black }	study skin		From the collection of Frank S Wright.	NA	NA	NA	NA	NA	NA
CUMV	NA	22865	NA			NA	Thraupidae	Tangara	nigrocincta		Stilpnia	nigrocincta	NA	male		Colombia		Juntas	NA	NA	NA	NA	215	215	8/3/07	1907	8	3	1907.08.03	NA			study skin		From the collection of Frank S Wright.	NA	NA	NA	NA	NA	NA
CUMV	NA	7564	NA	Mervyn G. Palmer		NA	Tyrannidae	Sayornis	nigricans	latirostris	Sayornis	nigricans	NA	male		Colombia		Jimenez, West Colombia, elevation 1600 ft.	NA	NA	NA	NA	218	218	8/6/07	1907	8	6	1907.08.06	NA		{colors:Bill color: black; Leg color: black }	study skin		From the collection of Frank S Wright.	NA	NA	NA	NA	NA	NA
CUMV	NA	7389	NA	Mervyn G. Palmer	MGP 2031	NA	Pipridae	Pipra	coronata	minuscula	Lepidothrix	coronata	NA	in question	immature	Colombia	Choc	Noanama, Rio San Juan, elevation 100 ft.	NA	NA	NA	NA	241	241	8/28/08	1908	8	28	1908.08.28	NA		{colors:Leg color: dark gray }	study skin		maxilla black, mandible blue; From the collection of Frank S Wright. From the collection of Henry K Coale #23181.	NA	NA	NA	NA	NA	NA
CUMV	NA	7281	NA	Mervyn G. Palmer	MGP 2451	NA	Cotingidae	Lipaugus	unirufus	castaneotinctus	Lipaugus	unirufus	NA	female		Colombia	Choc	Noanama, Rio San Juan, elevation 100 ft.	NA	NA	NA	NA	6	6	1/6/09	1909	1	6	1909.01.06	NA		{colors:Leg color: brown }	study skin		Maxilla (upper mandible) dark brown; lower mandible light brown.; From the collection of Frank S Wright.	NA	NA	NA	NA	NA	NA
CUMV	NA	7397	NA	Mervyn G. Palmer	MGP 2455	NA	Pipridae	Ceratopipra	mentalis	minor	Ceratopipra	mentalis	NA	male		Colombia	Choc	Noanama, Rio San Juan, elevation 100 ft.	NA	NA	NA	NA	8	8	1/8/09	1909	1	8	1909.01.08	NA		{colors:Leg color: light brown }	study skin		Maxilla dark brown, mandible light brown.; From the collection of Frank S Wright.	NA	NA	NA	NA	NA	NA
CUMV	NA	20913	NA	Mervyn G. Palmer		NA	Thraupidae	Chlorothraupis	olivacea		Chlorothraupis	olivacea	NA	female		Colombia	Choc	Rio San Juan	NA	NA	NA	NA	13	13	1/13/09	1909	1	13	1909.01.13	NA			study skin		From the collection of Frank S Wright.	NA	NA	NA	NA	NA	NA
CUMV	NA	7398	NA	Mervyn G. Palmer	MGP 2643	NA	Pipridae	Ceratopipra	mentalis	minor	Ceratopipra	mentalis	NA	female		Colombia	Choc	Tado, Rio San Juan, elevation 230 ft.	NA	NA	NA	NA	128	128	5/8/09	1909	5	8	1909.05.08	NA		{colors:Leg color: black }	study skin		maxilla: black, mandible: light brown; From the collection of Frank S Wright.	NA	NA	NA	NA	NA	NA
CUMV	NA	15899	NA			NA	Thraupidae	Dacnis	coerebicolor		Dacnis	cayana	NA	male		Colombia	Choc	Tado, Rio San Juan	NA	NA	NA	NA	141	141	5/21/09	1909	5	21	1909.05.21	NA			study skin		From the collection of Frank S Wright.	NA	NA	NA	NA	NA	NA
CUMV	NA	15853	NA			NA	Thraupidae	Cyanerpes	caeruleus		Cyanerpes	caeruleus	NA	male		Colombia	Choc	Rio San Juan	NA	NA	NA	NA	151	151	5/31/09	1909	5	31	1909.05.31	NA			study skin		From the collection of Frank S Wright.	NA	NA	NA	NA	NA	NA
CUMV	NA	15854	NA			NA	Thraupidae	Cyanerpes	caeruleus		Cyanerpes	caeruleus	NA	female		Colombia	Choc	Rio San Juan	NA	NA	NA	NA	152	152	6/1/09	1909	6	1	1909.06.01	NA			study skin		From the collection of Frank S Wright.	NA	NA	NA	NA	NA	NA
CUMV	NA	7287	NA	Mervyn G. Palmer	MGP 2686	NA	Tyrannidae	Rhytipterna	holerythra	rosenbergi	Rhytipterna	holerythra	NA	male		Colombia	Choc	Tado, Rio San Juan, elevation 230 ft.	NA	NA	NA	NA	153	153	6/2/09	1909	6	2	1909.06.02	NA		{colors:Bill color: black; Leg color: black }	study skin		From the collection of Frank S Wright.	NA	NA	NA	NA	NA	NA
CUMV	NA	20936	NA	Mervyn G. Palmer		NA	Thraupidae	Heterospingus	xanthopygius		Heterospingus	xanthopygius	NA	female		Colombia	Choc	Tado, Rio San Juan	NA	NA	NA	NA	167	167	6/16/09	1909	6	16	1909.06.16	NA			study skin		From the collection of Frank S Wright.	NA	NA	NA	NA	NA	NA
CUMV	NA	7329	NA	William Bebb Richardson	NA	NA	Cotingidae	Querula	purpurata		Querula	purpurata	NA	male	NA	Colombia	Cauca	San Jose, elevation 200 ft.	San Jose	NA	NA	NA	341	341	12/7/10	1910	12	7	1910.12.07	NA	testes enlarged	{colors:Bill color: bluish grey }	study skin	NA	NA	NA	NA	NA	NA	NA	NA
CUMV	NA	17674	NA	Louis Agassiz Fuertes		NA	Icteridae	Icterus	nigrogularis		Icterus	nigrogularis	NA	male		Colombia		Marangue, Magdalena River	Marangue	NA	NA	NA	1	1	1/1/11	1911	1	1	1911.01.01	NA			study skin	Locality not in gazeteer, see notes.		NA	NA	NA	NA	NA	NA
CUMV	NA	22838	NA	William Bebb Richardson		NA	Thraupidae	Tangara	arthus		Tangara	arthus	NA	male		Colombia	Cundinamarca	San Antonio	San Antonio	NA	2.982327	-76.50968	20	20	1/20/11	1911	1	20	1911.01.20	NA			study skin	Chapman Expedition no. 1; Site no. 54		NA	NA	NA	NA	NA	NA
CUMV	NA	7475	NA	William Bebb Richardson		NA	Pipridae	Manacus	vitellinus	viridiventris	Manacus	vitellinus	NA	male		Colombia	Cauca	Los Cisneros	Cisneros	NA	3.82	-76.78	79	79	3/20/11	1911	3	20	1911.03.20	NA			study skin	Expedition no. 1; Site no. 21	From the collection of Louis Agassiz Fuertes. From the collection of the American Museum of Natural History #108255.	NA	NA	NA	NA	NA	NA
CUMV	NA	5170	NA	Louis Agassiz Fuertes	LAF 2580	NA	Trochilidae	Heliangelus	exortis		Heliangelus	exortis	NA	male		Colombia		Central Andes, near El Eden [Elevation 8000 feet]	El Eden	NA	NA	NA	80	80	3/21/11	1911	3	21	1911.03.21	NA			study skin		From the collection of Louis Agassiz Fuertes.	NA	NA	NA	NA	NA	NA
CUMV	NA	22809	NA	Louis Agassiz Fuertes		NA	Thraupidae	Chlorochrysa	nitidissima		Chlorochrysa	nitidissima	NA	male		Colombia		San Antonio	San Antonio	NA	3.5	-76.63	86	86	3/27/11	1911	3	27	1911.03.27	NA			study skin	Expedition no. 1; Site no. 54		NA	NA	NA	NA	NA	NA
CUMV	NA	13073	NA	Louis Agassiz Fuertes	LAF 2282	NA	Troglodytidae	Thryothorus	genibarbis	saltuensis	Pheugopedius	mystacalis	NA	male		Colombia		El Tigre		NA	NA	NA	86	86	3/27/11	1911	3	27	1911.03.27	NA			study skin		Name on original label: Pheugopedius macrurus saltuensis	NA	NA	NA	NA	NA	NA
CUMV	NA	7263	NA	Louis Agassiz Fuertes	LAF 2286	NA	Cotingidae	Pipreola	riefferii	occidentalis	Pipreola	riefferii	NA	male		Colombia	Narino	San Antonio, elevation 6600 ft.	San Antonio	NA	NA	NA	86	86	3/27/11	1911	3	27	1911.03.27	NA		{colors:Bill color: cherry red }	study skin		Feet vermillion, orange lined	NA	NA	NA	NA	NA	NA
CUMV	NA	5121	NA	Louis Agassiz Fuertes	LAF 2288	NA	Trochilidae	Haplophaedia	aureliae	caucensis	Haplophaedia	aureliae	NA	female		Colombia	Narino	San Antonio [Elevation 6600 feet]	San Antonio	NA	NA	NA	86	86	3/27/11	1911	3	27	1911.03.27	NA			study skin		From the collection of Louis Agassiz Fuertes.	NA	NA	NA	NA	NA	NA
CUMV	NA	7264	NA	Louis Agassiz Fuertes	LAF 2287	NA	Cotingidae	Pipreola	riefferii	occidentalis	Pipreola	riefferii	NA	female		Colombia	Narino	San Antonio, elevation 6600 ft.	San Antonio	NA	NA	NA	86	86	3/27/11	1911	3	27	1911.03.27	NA		{colors:Bill color: cherry red }	study skin		Feet vermillion, orange soles	NA	NA	NA	NA	NA	NA
CUMV	NA	22992	NA	Louis Agassiz Fuertes		NA	Thraupidae	Tachyphonus	rufus		Tachyphonus	rufus	NA	male		Colombia		El Tigre		NA	NA	NA	86	86	3/27/11	1911	3	27	1911.03.27	NA			study skin	No given site no. or offical expedition dates in gazeteer.		NA	NA	NA	NA	NA	NA
CUMV	NA	5478	NA	Louis Agassiz Fuertes	LAF 2289	NA	Trogonidae	Pharomachrus	antisianus		Pharomachrus	antisianus	NA	male		Colombia	Narino	San Antonio	San Antonio	NA	3.467929	-76.54546	89	89	3/30/11	1911	3	30	1911.03.30	NA		{colors:Bill color: Corn yellow }	study skin	[Elevation 6600 feet]	Feet greenish yellow, dull; iris bright rose or magenta.; From the collection of Louis Agassiz Fuertes.	NA	NA	NA	NA	NA	NA
CUMV	NA	6339	NA	Louis Agassiz Fuertes	LAF 2293	NA	Picidae	Piculus	rubiginosus	gularis	Colaptes	rubiginosus	NA	female		Colombia	Narino	San Antonio	San Antonio	NA	3.467929	-76.54546	89	89	3/30/11	1911	3	30	1911.03.30	NA			study skin			NA	NA	NA	NA	NA	NA
CUMV	NA	6337	NA	Louis Agassiz Fuertes	LAF 2292	NA	Picidae	Piculus	rubiginosus	gularis	Colaptes	rubiginosus	NA	male		Colombia	Narino	San Antonio	San Antonio	NA	3.467929	-76.54546	89	89	3/30/11	1911	3	30	1911.03.30	NA			study skin			NA	NA	NA	NA	NA	NA
CUMV	NA	3359	NA	Louis Agassiz Fuertes	LAF 2615	NA	Cuculidae	Crotophaga	major		Crotophaga	major	NA	male		Colombia	Antioquia	Puerto Berrio, Magdalena River	Puerto Berrio	NA	NA	NA	89	89	3/30/11	1911	3	30	1911.03.30	NA			study skin		From the collection of Louis Agassiz Fuertes.	NA	NA	NA	NA	NA	NA
CUMV	NA	7236	NA	Louis Agassiz Fuertes		NA	Cotingidae	Pyroderus	scutatus	occidentalis	Pyroderus	scutatus	NA	female		Colombia	Narino	San Antonio	San Antonio	NA	3.467929	-76.54546	90	90	3/31/11	1911	3	31	1911.03.31	NA			study skin			NA	NA	NA	NA	NA	NA
CUMV	NA	6870	NA	Louis Agassiz Fuertes	LAF 2300	NA	Furnariidae	Lepidocolaptes	lacrymiger	lacrymiger	Lepidocolaptes	lacrymiger	NA	female		Colombia	Narino	San Antonio	San Antonio	NA	3.467929	-76.54546	90	90	3/31/11	1911	3	31	1911.03.31	NA			study skin	Chapman expedition no. 1; Site no. 54		NA	NA	NA	NA	NA	NA
CUMV	NA	22956	NA	Louis Agassiz Fuertes		NA	Thraupidae	Ramphocelus	flammigerus		Ramphocelus	flammigerus	NA	male		Colombia		San Antonio	San Antonio	NA	3.5	-76.63	90	90	3/31/11	1911	3	31	1911.03.31	NA			study skin	Chapman Expedition no.1 (March 30-April 7); Site no. 54		NA	NA	NA	NA	NA	NA
CUMV	NA	7069	NA	Louis Agassiz Fuertes	LAF 2297	NA	Thamnophilidae	Dysithamnus	mentalis	extremus	Dysithamnus	mentalis	NA	male		Colombia	Narino	San Antonio	San Antonio	NA	3.467929	-76.54546	90	90	3/31/11	1911	3	31	1911.03.31	NA			study skin	Chapman Expedition no. 1, Site no. 54		NA	NA	NA	NA	NA	NA
CUMV	NA	14067	NA	Louis Agassiz Fuertes	LAF 2296	NA	Turdidae	Myadestes	ralloides	plumbeiceps	Myadestes	ralloides	NA	male		Colombia	Narino	San Antonio, aqltitude 6600 feey	San Antonio	NA	NA	NA	90	90	3/31/11	1911	3	31	1911.03.31	NA			study skin			NA	NA	NA	NA	NA	NA
CUMV	NA	6653	NA	Louis Agassiz Fuertes		NA	Picidae	Picumnus	granadensis	granadensis	Picumnus	granadensis	NA	female		Colombia	Narino	San Antonio	San Antonio	NA	3.467929	-76.54546	91	91	4/1/11	1911	4	1	1911.04.01	NA			study skin			NA	NA	NA	NA	NA	NA
CUMV	NA	16972	NA	Louis Agassiz Fuertes		NA	Parulidae	Basileuterus	coronatus		Myiothlypis	coronata	NA	male		Colombia		San Antonio	San Antonio	NA	3.5	-76.63	91	91	4/1/11	1911	4	1	1911.04.01	NA			study skin	Expedition no. 1; Site no. 54		NA	NA	NA	NA	NA	NA
CUMV	NA	17965	NA	Louis Agassiz Fuertes		NA	Icteridae	Molothrus	bonariensis	cabanisii	Molothrus	bonariensis	NA	male		Colombia		San Antonio	San Antonio	NA	3.5	-76.63	91	91	4/1/11	1911	4	1	1911.04.01	NA			study skin	Chapman expedition no. 1; Site no. 54		NA	NA	NA	NA	NA	NA
CUMV	NA	18819	NA	Louis Agassiz Fuertes		NA	Fringillidae	Carduelis	xanthogastra		Spinus	xanthogastrus	NA	male		Colombia		San Antonio	San Antonio	NA	3.5	-76.63	91	91	4/1/11	1911	4	1	1911.04.01	NA			study skin	Chapman expedition no. 1; Site no. 54		NA	NA	NA	NA	NA	NA
CUMV	NA	7018	NA	Louis Agassiz Fuertes	LAF 2304	NA	Thamnophilidae	Thamnophilus	multistriatus		Thamnophilus	multistriatus	NA	male		Colombia	Narino	San Antonio	San Antonio	NA	3.467929	-76.54546	91	91	4/1/11	1911	4	1	1911.04.01	NA			study skin	Chapman expedition no. 1(March 30 -April 7); Site no. 54	legs, feet, lower mandible, and edge of upper mandible, pale lead blue	NA	NA	NA	NA	NA	NA
CUMV	NA	5128	NA	Louis Agassiz Fuertes	LAF 2311	NA	Trochilidae	Ocreatus	underwoodii	underwoodi	Ocreatus	underwoodii	NA	male		Colombia	Narino	San Antonio [Elevation 6200 feet]	San Antonio	NA	NA	NA	91	91	4/1/11	1911	4	1	1911.04.01	NA			study skin		From the collection of Louis Agassiz Fuertes.  Number 33 is recorded on the original label.	NA	NA	NA	NA	NA	NA
CUMV	NA	15829	NA	Louis Agassiz Fuertes		NA	Thraupidae	Diglossa			NA	NA	NA	female		Colombia		San Antonio	San Antonio	NA	3.5	-76.63	91	91	4/1/11	1911	4	1	1911.04.01	NA			study skin	Expedition no. 1; Site no. 54		NA	NA	NA	NA	NA	NA
CUMV	NA	7068	NA	Louis Agassiz Fuertes	LAF 2314	NA	Thamnophilidae	Dysithamnus	mentalis	extremus	Dysithamnus	mentalis	NA	female		Colombia	Narino	San Antonio	San Antonio	NA	3.467929	-76.54546	92	92	4/2/11	1911	4	2	1911.04.02	NA			study skin	Chapman Expedition no. 1, Site no. 54		NA	NA	NA	NA	NA	NA
CUMV	NA	22957	NA	Louis Agassiz Fuertes		NA	Thraupidae	Ramphocelus	flammigerus		Ramphocelus	flammigerus	NA	male		Colombia		San Antonio	San Antonio	NA	3.5	-76.63	92	92	4/2/11	1911	4	2	1911.04.02	NA			study skin	Chapman Expedition no.1 (March 30 - April 7); Site no. 54		NA	NA	NA	NA	NA	NA
CUMV	NA	16981	NA	Louis Agassiz Fuertes		NA	Parulidae	Basileuterus	tristriatus		Basileuterus	tristriatus	NA	female		Colombia		San Antonio	San Antonio	NA	3.5	-76.63	92	92	4/2/11	1911	4	2	1911.04.02	NA			study skin	Expedition no. 1; Site no. 54		NA	NA	NA	NA	NA	NA
CUMV	NA	19037	NA	Louis Agassiz Fuertes		NA	Emberizidae	Atlapetes	gutturalis		Atlapetes	albinucha	NA	male		Colombia		San Antonio	San Antonio	NA	3.5	-76.63	92	92	4/2/11	1911	4	2	1911.04.02	NA			study skin	Chapman expedition no. 1; Site no. 54		NA	NA	NA	NA	NA	NA
CUMV	NA	7067	NA	Louis Agassiz Fuertes	LAF 2313	NA	Thamnophilidae	Dysithamnus	mentalis	extremus	Dysithamnus	mentalis	NA	male		Colombia	Narino	San Antonio	San Antonio	NA	3.467929	-76.54546	92	92	4/2/11	1911	4	2	1911.04.02	NA			study skin	Chapman Expedition no. 1, Site no. 54		NA	NA	NA	NA	NA	NA
CUMV	NA	4592	NA	Louis Agassiz Fuertes	LAF 2312A	NA	Trochilidae	Hylocharis	grayi		Hylocharis	grayi	NA	female		Colombia	Narino	San Antonio	San Antonio	NA	3.467929	-76.54546	92	92	4/2/11	1911	4	2	1911.04.02	NA			study skin		From the collection of Louis Agassiz Fuertes.	NA	NA	NA	NA	NA	NA
CUMV	NA	17966	NA	Louis Agassiz Fuertes		NA	Icteridae	Molothrus	bonariensis	cabanisii	Molothrus	bonariensis	NA	male	juvenile	Colombia		San Antonio	San Antonio	NA	3.5	-76.63	92	92	4/2/11	1911	4	2	1911.04.02	NA			study skin	Chapman expedition no. 1; Site no. 54		NA	NA	NA	NA	NA	NA
CUMV	NA	1153	NA	Louis Agassiz Fuertes	LAF 2316	NA	Falconidae	Falco	sparverius	caucae	Falco	sparverius	NA	male		Colombia	Valle del Cauca	Cauca Valley, San Antonio, near Cali; Valle	San Antonio	NA	NA	NA	92	92	4/2/11	1911	4	2	1911.04.02	NA			study skin			NA	NA	NA	NA	NA	NA
CUMV	NA	7289	NA	Louis Agassiz Fuertes	LAF 2322	NA	Cotingidae	Pachyramphus	versicolor	versicolor	Pachyramphus	versicolor	NA	male		Colombia	Narino	San Antonio	San Antonio	NA	3.467929	-76.54546	93	93	4/3/11	1911	4	3	1911.04.03	NA			study skin			NA	NA	NA	NA	NA	NA
CUMV	NA	5129	NA	Louis Agassiz Fuertes	LAF 2323	NA	Trochilidae	Ocreatus	underwoodii	underwoodi	Ocreatus	underwoodii	NA	female		Colombia	Narino	San Antonio	San Antonio	NA	3.467929	-76.54546	93	93	4/3/11	1911	4	3	1911.04.03	NA			study skin		From the collection of Louis Agassiz Fuertes.	NA	NA	NA	NA	NA	NA
CUMV	NA	3128	NA	Louis Agassiz Fuertes	LAF 2320	NA	Columbidae	Geotrygon	frenata	bourcieri	Zentrygon	frenata	NA	male		Colombia		San Antonio	San Antonio	NA	3.5	-76.63	93	93	4/3/11	1911	4	3	1911.04.03	NA		{colors:Bill color: Black }	study skin		Small eyespace carmine; scales on legs and feet carmine; smooth skin flesh color, dull.; From the collection of Louis Agassiz Fuertes.	NA	NA	NA	NA	NA	NA
CUMV	NA	3034	NA	Louis Agassiz Fuertes	LAF 2321	NA	Columbidae	Columba	fasciata	albilinea	Patagioenas	fasciata	NA	male		Colombia	Narino	San Antonio; Norino	San Antonio	NA	NA	NA	93	93	4/3/11	1911	4	3	1911.04.03	NA			study skin		Feet light cadmium yellow; entire bill same; iris crown, yellow line around pupil; lids carmine.; From the collection of Louis Agassiz Fuertes.	NA	NA	NA	NA	NA	NA
CUMV	NA	1014	NA	Louis Agassiz Fuertes	LAF 2324	NA	Accipitridae	Buteo	platypterus	platypterus	Buteo	platypterus	NA	male		Colombia		San Antonio, elevation 6600 feet	San Antonio	NA	NA	NA	93	93	4/3/11	1911	4	3	1911.04.03	NA			study skin		From the collection of Louis Agassiz Fuertes.	NA	NA	NA	NA	NA	NA
CUMV	NA	3173	NA	Louis Agassiz Fuertes	LAF 2330	NA	Psittacidae	Aratinga	wagleri	wagleri	Psittacara	wagleri	NA	male		Colombia	Narino	San Antonio	San Antonio	NA	3.467929	-76.54546	94	94	4/4/11	1911	4	4	1911.04.04	NA			study skin		From the collection of Louis Agassiz Fuertes.	NA	NA	NA	NA	NA	NA
CUMV	NA	5477	NA	Louis Agassiz Fuertes	LAF 2325	NA	Trogonidae	Pharomachrus	antisianus		Pharomachrus	antisianus	NA	male	immature	Colombia	Narino	San Antonio	San Antonio	NA	3.467929	-76.54546	94	94	4/4/11	1911	4	4	1911.04.04	NA			study skin	[Elevation 6600 feet]	From the collection of Louis Agassiz Fuertes.	NA	NA	NA	NA	NA	NA
CUMV	NA	22873	NA	Louis Agassiz Fuertes		NA	Thraupidae	Tangara	ruficervix		Chalcothraupis	ruficervix	NA	male		Colombia		San Antonio	San Antonio	NA	3.5	-76.63	94	94	4/4/11	1911	4	4	1911.04.04	NA			study skin	Chapman Expedition no.1, (March 30- April 7); Site no. 54		NA	NA	NA	NA	NA	NA
CUMV	NA	17967	NA	Louis Agassiz Fuertes		NA	Icteridae	Molothrus	bonariensis	cabanisii	Molothrus	bonariensis	NA	female		Colombia		San Antonio	San Antonio	NA	3.5	-76.63	94	94	4/4/11	1911	4	4	1911.04.04	NA			study skin	Chapman expedition no. 1; Site no. 54		NA	NA	NA	NA	NA	NA
CUMV	NA	1770	NA	Louis Agassiz Fuertes	LAF 2327	NA	Charadriidae	Vanellus	chilensis	cayennensis	Vanellus	chilensis	NA	male		Colombia	Narino	San Antonio	San Antonio	NA	3.467929	-76.54546	94	94	4/4/11	1911	4	4	1911.04.04	NA			study skin		Fat eyelids magenta; basal half of bill and tibia dark pink; tarsi and feet dark; iris carmine, deep.	NA	NA	NA	NA	NA	NA
CUMV	NA	6390	NA	Louis Agassiz Fuertes	LAF 2329	NA	Picidae	Campephilus	malherbii		Campephilus	melanoleucos	NA	male		Colombia	Narino	San Antonio	San Antonio	NA	3.467929	-76.54546	94	94	4/4/11	1911	4	4	1911.04.04	NA			study skin			NA	NA	NA	NA	NA	NA
CUMV	NA	22916	NA	Louis Agassiz Fuertes		NA	Thraupidae	Tangara	heinei		Stilpnia	heinei	NA	female		Colombia		San Antonio	San Antonio	NA	3.5	-76.63	94	94	4/4/11	1911	4	4	1911.04.04	NA			study skin	Chapman Expedition no. 1; Site no. 54		NA	NA	NA	NA	NA	NA
CUMV	NA	3035	NA	Louis Agassiz Fuertes	LAF 2326	NA	Columbidae	Columba	fasciata	albilinea	Patagioenas	fasciata	NA	male		Colombia	Narino	San Antonio; Norino	San Antonio	NA	NA	NA	94	94	4/4/11	1911	4	4	1911.04.04	NA			study skin		From the collection of Louis Agassiz Fuertes.	NA	NA	NA	NA	NA	NA
CUMV	NA	6951	NA	Louis Agassiz Fuertes	LAF 2335	NA	Furnariidae	Premnoplex	brunnescens	brunnescens	Premnoplex	brunnescens	NA	male		Colombia	Narino	San Antonio	San Antonio	NA	3.467929	-76.54546	95	95	4/5/11	1911	4	5	1911.04.05	NA			study skin			NA	NA	NA	NA	NA	NA
CUMV	NA	1	NA	Louis Agassiz Fuertes	LAF 2333	NA	Tinamidae	Tinamus	tao		Tinamus	tao	NA	male		Colombia		San Antonio	San Antonio	NA	3.5	-76.63	95	95	4/5/11	1911	4	5	1911.04.05	NA		{colors:Leg color: light blue,dull }	study skin		bill: pale blue below, dark above; From the collection of Louis Agassiz Fuertes.	NA	NA	NA	NA	NA	NA
CUMV	NA	8351	NA	Louis Agassiz Fuertes		NA	Tyrannidae	Phyllomyias	plumbeiceps		Phyllomyias	plumbeiceps	NA	male		Colombia	Narino	San Antonio	San Antonio	NA	3.467929	-76.54546	95	95	4/5/11	1911	4	5	1911.04.05	NA			study skin		From the collection of Louis Agassiz Fuertes.	NA	NA	NA	NA	NA	NA
CUMV	NA	5494	NA	Louis Agassiz Fuertes	LAF 2334	NA	Trogonidae	Trogon	collaris	collaris	Trogon	collaris	NA	male		Colombia	Narino	San Antonio [Elevation 6600 feet]	San Antonio	NA	NA	NA	95	95	4/5/11	1911	4	5	1911.04.05	NA			study skin	Bird shot on 4th, lost, found on 5th.  Eye damaged and spider. (as it's recorded on the label)	Eyelids scarlet; feet greenish gray.; From the collection of Louis Agassiz Fuertes.	NA	NA	NA	NA	NA	NA
CUMV	NA	16939	NA	Louis Agassiz Fuertes		NA	Parulidae	Myioborus	verticalis		Myioborus	miniatus	NA	male		Colombia		San Antonio	San Antonio	NA	3.5	-76.63	96	96	4/6/11	1911	4	6	1911.04.06	NA			study skin	Expedition no. 1; Site no. 54		NA	NA	NA	NA	NA	NA
CUMV	NA	6063	NA	Louis Agassiz Fuertes		NA	Ramphastidae	Aulacorhynchus	haematopygus		Aulacorhynchus	haematopygus	NA	male		Colombia	Narino	San Antonio	San Antonio	NA	3.467929	-76.54546	96	96	4/6/11	1911	4	6	1911.04.06	NA			study skin			NA	NA	NA	NA	NA	NA
CUMV	NA	19069	NA	Louis Agassiz Fuertes		NA	Emberizidae	Atlapetes	brunneinucha		Arremon	brunneinucha	NA	undetermined	juvenile	Colombia		San Antonio	San Antonio	NA	3.5	-76.63	96	96	4/6/11	1911	4	6	1911.04.06	NA			study skin	Chapman expedition no. 1; Site no. 54		NA	NA	NA	NA	NA	NA
CUMV	NA	16938	NA	Louis Agassiz Fuertes		NA	Parulidae	Myioborus	verticalis		Myioborus	miniatus	NA	female		Colombia		San Antonio	San Antonio	NA	3.5	-76.63	96	96	4/6/11	1911	4	6	1911.04.06	NA			study skin	Expedition no. 1; Site no. 54		NA	NA	NA	NA	NA	NA
CUMV	NA	3673	NA	Louis Agassiz Fuertes	LAF 2341	NA	Apodidae	Streptoprocne	zonaris	albicincta	Streptoprocne	zonaris	NA	female		Colombia	Narino	San Antonio, elevation 6400 feet	San Antonio	NA	NA	NA	96	96	4/6/11	1911	4	6	1911.04.06	NA			study skin			NA	NA	NA	NA	NA	NA
CUMV	NA	3674	NA	Louis Agassiz Fuertes	LAF 2342	NA	Apodidae	Streptoprocne	zonaris	albicincta	Streptoprocne	zonaris	NA	female		Colombia	Narino	San Antonio, elevation 6400 feet	San Antonio	NA	NA	NA	96	96	4/6/11	1911	4	6	1911.04.06	NA			study skin			NA	NA	NA	NA	NA	NA
CUMV	NA	3681	NA	Louis Agassiz Fuertes	LAF 2340	NA	Apodidae	Streptoprocne	rutila	brunnitorques	Streptoprocne	rutila	NA	male		Colombia	Narino	San Antonio, elevation 4000 feet	San Antonio	NA	NA	NA	96	96	4/6/11	1911	4	6	1911.04.06	NA			study skin			NA	NA	NA	NA	NA	NA
CUMV	NA	3301	NA	Louis Agassiz Fuertes	LAF 2350	NA	Cuculidae	Coccyzus	melacoryphus		Coccyzus	melacoryphus	NA	male		Colombia	Valle del Cauca	Palmira; Valle	Palmira	NA	3.53	-76.3	101	101	4/11/11	1911	4	11	1911.04.11	NA			study skin		From the collection of Louis Agassiz Fuertes.	NA	NA	NA	NA	NA	NA
CUMV	NA	3212	NA	Louis Agassiz Fuertes	LAF 2348	NA	Psittacidae	Forpus	conspicillatus	caucae	Forpus	conspicillatus	NA	male		Colombia	Valle del Cauca	Palmira; Valle	Palmira	NA	3.53	-76.3	101	101	4/11/11	1911	4	11	1911.04.11	NA			study skin		From the collection of Louis Agassiz Fuertes.	NA	NA	NA	NA	NA	NA
CUMV	NA	18134	NA	Louis Agassiz Fuertes		NA	Cardinalidae	Saltator	atripennis		Saltator	atripennis	NA	male		Colombia		San Antonio	San Antonio	NA	3.5	-76.63	101	101	4/11/11	1911	4	11	1911.04.11	NA			study skin	Collected 4 days after offical Chapman expediton no.1 (March 30- April 7); Site no. 54		NA	NA	NA	NA	NA	NA
CUMV	NA	18087	NA	Louis Agassiz Fuertes		NA	Icteridae	Psarocolius	decumanus		Psarocolius	decumanus	NA	male		Colombia	Valle del Cauca	La Manuelita, Palmira; Valle	La Manuelita	NA	3.572723	-76.276565	101	101	4/11/11	1911	4	11	1911.04.11	NA			study skin	Chapman expedition no. 1; Site no. 51		NA	NA	NA	NA	NA	NA
CUMV	NA	6377	NA	Louis Agassiz Fuertes	LAF 2347	NA	Picidae	Dryocopus	lineatus	nuperus	Dryocopus	lineatus	NA	male		Colombia	Valle del Cauca	Palmira; Valle	Palmira	NA	3.53	-76.3	101	101	4/11/11	1911	4	11	1911.04.11	NA			study skin			NA	NA	NA	NA	NA	NA
CUMV	NA	22959	NA	Louis Agassiz Fuertes		NA	Thraupidae	Ramphocelus	chrysonotus		Ramphocelus	flammigerus	NA	female		Colombia		La Manuelita	La Manuelita	NA	3.57	-76.28	101	101	4/11/11	1911	4	11	1911.04.11	NA			study skin	Expedition no. 1; Site no. 51		NA	NA	NA	NA	NA	NA
CUMV	NA	18091	NA	Louis Agassiz Fuertes		NA	Icteridae	Psarocolius	decumanus		Psarocolius	decumanus	NA	female		Colombia	Valle del Cauca	La Manuelita; Valle	La Manuelita	NA	3.572723	-76.276565	101	101	4/11/11	1911	4	11	1911.04.11	NA			study skin	Chapman expedition no. 1; Site no. 51		NA	NA	NA	NA	NA	NA
CUMV	NA	1026	NA	Louis Agassiz Fuertes	LAF 2346	NA	Accipitridae	Buteo	magnirostris		Rupornis	magnirostris	NA	female		Colombia	Valle del Cauca	La Marmelita, Palmira, elevation 3500 feet; Valle	La Manuelita	NA	NA	NA	101	101	4/11/11	1911	4	11	1911.04.11	NA		{measurements:Bill Length: not taken; Culmen Length: not taken; Tail Length: 168.50; Tarsus Length: not taken; Middle Toe Length: not taken;,wing chord:229 }	study skin		From the collection of Louis Agassiz Fuertes.	NA	NA	NA	NA	NA	NA
CUMV	NA	3027	NA	Louis Agassiz Fuertes	LAF 2351	NA	Columbidae	Columba	cayennensis		Patagioenas	cayennensis	NA	male		Colombia	Valle del Cauca	Palmira; Valle	Palmira	NA	3.53	-76.3	102	102	4/12/11	1911	4	12	1911.04.12	NA			study skin		From the collection of Louis Agassiz Fuertes.	NA	NA	NA	NA	NA	NA
CUMV	NA	6915	NA	Louis Agassiz Fuertes	LAF 2354	NA	Furnariidae	Synallaxis	albescens	albigularis	Synallaxis	albescens	NA	male		Colombia	Valle del Cauca	La Manuelita, Palmira; Valle	La Manuelita	NA	3.572723	-76.276565	102	102	4/12/11	1911	4	12	1911.04.12	NA			study skin			NA	NA	NA	NA	NA	NA
CUMV	NA	9004	NA	Louis Agassiz Fuertes		NA	Hirundinidae	Stelgidopteryx	ruficollis		Stelgidopteryx	ruficollis	NA	female		Colombia	Valle del Cauca	La Manuelita, Palmira; Valle	La Manuelita	NA	3.572723	-76.276565	102	102	4/12/11	1911	4	12	1911.04.12	NA			study skin	Official Chapman Expedition no. 1; Site no. 51		NA	NA	NA	NA	NA	NA
CUMV	NA	14011	NA	Louis Agassiz Fuertes		NA	Turdidae	Turdus	ignobilis	goodfellowi	Turdus	ignobilis	NA	male		Colombia	Valle del Cauca	La Manuelita, Palmira; Valle	La Manuelita	NA	3.572723	-76.276565	102	102	4/12/11	1911	4	12	1911.04.12	NA			study skin			NA	NA	NA	NA	NA	NA
CUMV	NA	23007	NA	Louis Agassiz Fuertes		NA	Thraupidae	Eucometis	penicillata		Eucometis	penicillata	NA	female		Colombia	Valle del Cauca	Palmira; Valle	Palmira	NA	3.53	-76.3	102	102	4/12/11	1911	4	12	1911.04.12	NA			study skin			NA	NA	NA	NA	NA	NA
CUMV	NA	22994	NA	Louis Agassiz Fuertes		NA	Thraupidae	Tachyphonus	rufus		Tachyphonus	rufus	NA	male		Colombia	Valle del Cauca	Palmira; Valle	Palmira	NA	3.53	-76.3	102	102	4/12/11	1911	4	12	1911.04.12	NA			study skin	Collected during offical Chapman expedition no. 1 (April 12-18); Near site no. 51, La Manuelita		NA	NA	NA	NA	NA	NA
CUMV	NA	1771	NA	Louis Agassiz Fuertes	LAF 2858	NA	Charadriidae	Vanellus	chilensis	cayennensis	Vanellus	chilensis	NA	male		Colombia	Valle del Cauca	Palmira, La Manuelita, elevation 3500 feet; Valle	La Manuelita	NA	NA	NA	102	102	4/12/11	1911	4	12	1911.04.12	NA			study skin			NA	NA	NA	NA	NA	NA
CUMV	NA	3343	NA	Louis Agassiz Fuertes	LAF 2352	NA	Cuculidae	Tapera	naevia	naevia	Tapera	naevia	NA			Colombia	Valle del Cauca	Cauca Valley, Palmira; Valle	Palmira	NA	NA	NA	102	102	4/12/11	1911	4	12	1911.04.12	NA			study skin		From the collection of Louis Agassiz Fuertes.	NA	NA	NA	NA	NA	NA
CUMV	NA	3143	NA	Louis Agassiz Fuertes	LAF 2368	NA	Psittacidae	Ara	severa	castaneifrons	Ara	severus	NA	male		Colombia	Valle del Cauca	Palmira; Valle	Palmira	NA	3.53	-76.3	103	103	4/13/11	1911	4	13	1911.04.13	NA			study skin		From the collection of Louis Agassiz Fuertes.	NA	NA	NA	NA	NA	NA
CUMV	NA	3302	NA	Louis Agassiz Fuertes	LAF 2352	NA	Cuculidae	Coccyzus	melacoryphus		Coccyzus	melacoryphus	NA	male		Colombia	Valle del Cauca	Palmira; Valle	Palmira	NA	3.53	-76.3	103	103	4/13/11	1911	4	13	1911.04.13	NA			study skin		From the collection of Louis Agassiz Fuertes.	NA	NA	NA	NA	NA	NA
CUMV	NA	18054	NA	Louis Agassiz Fuertes		NA	Icteridae	Molothrus	oryzivora		Molothrus	oryzivorus	NA	male		Colombia	Valle del Cauca	La Manuelita, Palmira; Valle	La Manuelita	NA	3.572723	-76.276565	103	103	4/13/11	1911	4	13	1911.04.13	NA			study skin	Chapman expedition no. 1; Site no. 51		NA	NA	NA	NA	NA	NA
CUMV	NA	22943	NA	Louis Agassiz Fuertes		NA	Thraupidae	Ramphocelus	dimidiatus		Ramphocelus	dimidiatus	NA	female		Colombia	Valle del Cauca	Palmira; Valle	Palmira	NA	3.53	-76.3	103	103	4/13/11	1911	4	13	1911.04.13	NA			study skin			NA	NA	NA	NA	NA	NA
CUMV	NA	18137	NA	Louis Agassiz Fuertes		NA	Cardinalidae	Saltator	albicollis		Saltator	albicollis	NA	male		Colombia		La Manuelita	La Manuelita	NA	3.57	-76.28	103	103	4/13/11	1911	4	13	1911.04.13	NA			study skin	Expedition no. 1 (April 12 -18); Site no. 51		NA	NA	NA	NA	NA	NA
CUMV	NA	8326	NA	Louis Agassiz Fuertes		NA	Tyrannidae	Todirostrum	sylvia	superciliare	Poecilotriccus	sylvia	NA	female		Colombia	Valle del Cauca	La Manuelita, Palmira; Valle	La Manuelita	NA	3.572723	-76.276565	103	103	4/13/11	1911	4	13	1911.04.13	NA			study skin			NA	NA	NA	NA	NA	NA
CUMV	NA	22993	NA	Louis Agassiz Fuertes		NA	Thraupidae	Tachyphonus	rufus		Tachyphonus	rufus	NA	in question		Colombia	Valle del Cauca	Palmira; Valle	Palmira	NA	3.53	-76.3	103	103	4/13/11	1911	4	13	1911.04.13	NA			study skin	Collected during offical Chapman expedition no. 1 (April 12-18); Near site no. 51, La Manuelita		NA	NA	NA	NA	NA	NA
CUMV	NA	8285	NA	Louis Agassiz Fuertes		NA	Tyrannidae	Tolmomyias	sulphurescens	asemus	Tolmomyias	sulphurescens	NA	male		Colombia	Valle del Cauca	La Manuelita, Palmira; Valle	La Manuelita	NA	3.572723	-76.276565	103	103	4/13/11	1911	4	13	1911.04.13	NA			study skin			NA	NA	NA	NA	NA	NA
CUMV	NA	1163	NA	Louis Agassiz Fuertes	LAF 2366	NA	Cracidae	Ortalis	motmot	colombiana	Ortalis	motmot	NA	male		Colombia	Valle del Cauca	La Manuelita, Palmira, elevation 3500 feet; Valle	La Manuelita	NA	NA	NA	103	103	4/13/11	1911	4	13	1911.04.13	NA			study skin		From the collection of Louis Agassiz Fuertes.	NA	NA	NA	NA	NA	NA
CUMV	NA	3324	NA	Louis Agassiz Fuertes	LAF 2360	NA	Cuculidae	Piaya	minuta	gracilis	Coccycua	minuta	NA	male		Colombia	Valle del Cauca	Palmira, Cauca Valley; Valle	Palmira	NA	NA	NA	103	103	4/13/11	1911	4	13	1911.04.13	NA			study skin		From the collection of Louis Agassiz Fuertes.	NA	NA	NA	NA	NA	NA
CUMV	NA	3174	NA	Louis Agassiz Fuertes	LAF 2370	NA	Psittacidae	Aratinga	wagleri	wagleri	Psittacara	wagleri	NA	male		Colombia	Valle del Cauca	Palmira; Valle	Palmira	NA	3.53	-76.3	104	104	4/14/11	1911	4	14	1911.04.14	NA			study skin		From the collection of Louis Agassiz Fuertes.	NA	NA	NA	NA	NA	NA
CUMV	NA	20243	NA	Louis Agassiz Fuertes		NA	Emberizidae	Zonotrichia	capensis	peruviensis	Zonotrichia	capensis	NA	male		Colombia	Valle del Cauca	Palmira; Valle del Cauca	Palmira	NA	3.58318	-76.249799	104	104	4/14/11	1911	4	14	1911.04.14	NA			study skin			NA	NA	NA	NA	NA	NA
CUMV	NA	3175	NA	Louis Agassiz Fuertes	LAF 2371	NA	Psittacidae	Aratinga	wagleri	wagleri	Psittacara	wagleri	NA	male		Colombia	Valle del Cauca	Palmira; Valle	Palmira	NA	3.53	-76.3	104	104	4/14/11	1911	4	14	1911.04.14	NA			study skin		From the collection of Louis Agassiz Fuertes.	NA	NA	NA	NA	NA	NA
CUMV	NA	3615	NA	Louis Agassiz Fuertes	LAF 2373	NA	Caprimulgidae	Nyctidromus	albicollis	albicollis	Nyctidromus	albicollis	NA	male		Colombia	Valle del Cauca	La Manuelita, Palmira; Valle	La Manuelita	NA	3.572723	-76.276565	104	104	4/14/11	1911	4	14	1911.04.14	NA			study skin			NA	NA	NA	NA	NA	NA
CUMV	NA	19424	NA	Louis Agassiz Fuertes		NA	Emberizidae	Ammodramus	humeralis	columbiana	Ammodramus	humeralis	NA	male		Colombia	Valle del Cauca	La Manuelita, Palmira; Valle	La Manuelita	NA	3.572723	-76.276565	104	104	4/14/11	1911	4	14	1911.04.14	NA			study skin	Chapman expedition no. 1; Site no. 52		NA	NA	NA	NA	NA	NA
CUMV	NA	6917	NA	Louis Agassiz Fuertes	LAF 2377	NA	Furnariidae	Synallaxis	brachyura	caucae	Synallaxis	brachyura	NA	male		Colombia	Valle del Cauca	La Manuelita, Palmira; Valle	La Manuelita	NA	3.572723	-76.276565	104	104	4/14/11	1911	4	14	1911.04.14	NA			study skin			NA	NA	NA	NA	NA	NA
CUMV	NA	22958	NA	Louis Agassiz Fuertes		NA	Thraupidae	Ramphocelus	flammigerus		Ramphocelus	flammigerus	NA	female		Colombia		La Manuelita	La Manuelita	NA	3.57	-76.28	104	104	4/14/11	1911	4	14	1911.04.14	NA			study skin	Chapman Expedition no. 1 (April 12-18); Site no. 51		NA	NA	NA	NA	NA	NA
CUMV	NA	6654	NA	Louis Agassiz Fuertes		NA	Picidae	Picumnus	granadensis	granadensis	Picumnus	granadensis	NA	male		Colombia	Valle del Cauca	Palmira; Valle	Palmira	NA	3.53	-76.3	105	105	4/15/11	1911	4	15	1911.04.15	NA			study skin			NA	NA	NA	NA	NA	NA
CUMV	NA	18053	NA	Louis Agassiz Fuertes		NA	Icteridae	Molothrus	oryzivora		Molothrus	oryzivorus	NA	male		Colombia	Valle del Cauca	La Manuelita, Palmira; Valle	La Manuelita	NA	3.572723	-76.276565	105	105	4/15/11	1911	4	15	1911.04.15	NA			study skin	Chapman expedition no. 1; Site no. 51		NA	NA	NA	NA	NA	NA
CUMV	NA	6517	NA	Louis Agassiz Fuertes	LAF 2386	NA	Picidae	Veniliornis	kirkii	cecilii	Dryobates	kirkii	NA	female		Colombia	Valle del Cauca	Palmira; Valle	Palmira	NA	3.53	-76.3	105	105	4/15/11	1911	4	15	1911.04.15	NA			study skin			NA	NA	NA	NA	NA	NA
CUMV	NA	22944	NA	Louis Agassiz Fuertes		NA	Thraupidae	Ramphocelus	dimidiatus		Ramphocelus	dimidiatus	NA	female		Colombia	Valle del Cauca	Palmira; Valle	Palmira	NA	3.53	-76.3	105	105	4/15/11	1911	4	15	1911.04.15	NA			study skin			NA	NA	NA	NA	NA	NA
CUMV	NA	6841	NA	Louis Agassiz Fuertes	LAF 2383	NA	Furnariidae	Xiphorhynchus	guttatus	nanus	Xiphorhynchus	guttatus	NA	female		Colombia	Valle del Cauca	La Manuelita, Palmira; Valle	La Manuelita	NA	3.572723	-76.276565	105	105	4/15/11	1911	4	15	1911.04.15	NA			study skin			NA	NA	NA	NA	NA	NA
CUMV	NA	1072	NA	Louis Agassiz Fuertes	LAF 2382	NA	Falconidae	Milvago	chimachima	cordatus	Milvago	chimachima	NA	male		Colombia	Valle del Cauca	Palmira, La Manuelita; Valle	La Manuelita	NA	NA	NA	105	105	4/15/11	1911	4	15	1911.04.15	NA			study skin	'La Mannelita'	From the collection of Louis Agassiz Fuertes.	NA	NA	NA	NA	NA	NA
CUMV	NA	1658	NA	Louis Agassiz Fuertes	LAF 2380	NA	Rallidae	Pardirallus	nigricans	nigricans	Pardirallus	nigricans	NA	male		Colombia	Valle del Cauca	Palmira, La Manuelita, elevation 3500 feet; Valle	La Manuelita	NA	NA	NA	105	105	4/15/11	1911	4	15	1911.04.15	NA			study skin			NA	NA	NA	NA	NA	NA
CUMV	NA	19038	NA	Louis Agassiz Fuertes		NA	Emberizidae	Atlapetes	gutturalis		Atlapetes	albinucha	NA	male		Colombia	Valle del Cauca	Miraflores, Palmira	Miraflores	NA	NA	NA	105	105	4/15/11	1911	4	15	1911.04.15	NA			study skin	Chapman expedition no. 1; Site no. 52, check locality remarks		NA	NA	NA	NA	NA	NA
CUMV	NA	3616	NA	Louis Agassiz Fuertes	LAF 2387	NA	Caprimulgidae	Nyctidromus	albicollis	albicollis	Nyctidromus	albicollis	NA	male		Colombia	Valle del Cauca	La Manuelita, Palmira, elevation 3500 feet; Valle	La Manuelita	NA	NA	NA	105	105	4/15/11	1911	4	15	1911.04.15	NA			study skin			NA	NA	NA	NA	NA	NA
CUMV	NA	3318	NA	Louis Agassiz Fuertes	LAF 2378	NA	Cuculidae	Piaya	cayana	nigricrissa	Piaya	cayana	NA	male		Colombia	Valle del Cauca	Palmira, Cauca Valley; Valle	Palmira	NA	NA	NA	105	105	4/15/11	1911	4	15	1911.04.15	NA			study skin		From the collection of Louis Agassiz Fuertes.	NA	NA	NA	NA	NA	NA
CUMV	NA	1772	NA	Louis Agassiz Fuertes	LAF 2389	NA	Charadriidae	Vanellus	chilensis	cayennensis	Vanellus	chilensis	NA	undetermined	natal	Colombia	Valle del Cauca	Palmira, La Manuelita, elevation 3500 feet; Valle	La Manuelita	NA	NA	NA	105	105	4/15/11	1911	4	15	1911.04.15	NA			study skin			NA	NA	NA	NA	NA	NA
CUMV	NA	4871	NA	Louis Agassiz Fuertes	LAF 2385	NA	Trochilidae	Anthracothorax	nigricollis		Anthracothorax	nigricollis	NA	male		Colombia	Valle del Cauca	Palmira, La Manuelita, elevation 3500 feet; Valle	La Manuelita	NA	NA	NA	105	105	4/15/11	1911	4	15	1911.04.15	NA			study skin		From the collection of Louis Agassiz Fuertes.	NA	NA	NA	NA	NA	NA
CUMV	NA	1657	NA	Louis Agassiz Fuertes	LAF 2379	NA	Rallidae	Pardirallus	nigricans	nigricans	Pardirallus	nigricans	NA	male		Colombia	Valle del Cauca	Palmira, La Manuelita, elevation 3500 feet; Valle	La Manuelita	NA	NA	NA	105	105	4/15/11	1911	4	15	1911.04.15	NA			study skin		Base of bill yellow green; green lemon on lower mandible; legs and feet coral pink.	NA	NA	NA	NA	NA	NA
CUMV	NA	5479	NA	Louis Agassiz Fuertes	LAF 2393	NA	Trogonidae	Pharomachrus	auriceps		Pharomachrus	auriceps	NA	male		Colombia	Valle del Cauca	Miraflores, Palmira	Miraflores	NA	NA	NA	107	107	4/17/11	1911	4	17	1911.04.17	NA			study skin	[Elevation 6600 feet]	From the collection of Louis Agassiz Fuertes.  Number 115 is recorded on the original label.	NA	NA	NA	NA	NA	NA
CUMV	NA	14068	NA	Louis Agassiz Fuertes	LAF 2390	NA	Turdidae	Myadestes	ralloides	plumbeiceps	Myadestes	ralloides	NA	male		Colombia	Valle del Cauca	Miraflores, Palmira, elevation 6500 feet; Valle	Miraflores	NA	NA	NA	107	107	4/17/11	1911	4	17	1911.04.17	NA			study skin			NA	NA	NA	NA	NA	NA
CUMV	NA	3167	NA	Louis Agassiz Fuertes	LAF 2394	NA	Psittacidae	Ognorhynchus	icterotis		Ognorhynchus	icterotis	NA	female		Colombia	Valle del Cauca	Miraflores, Palmira	Miraflores	NA	NA	NA	107	107	4/17/11	1911	4	17	1911.04.17	NA			study skin		From the collection of Louis Agassiz Fuertes.	NA	NA	NA	NA	NA	NA
